CODICE FISCALE,DENOMINAZIONE,REGIONE,PROVINCIA,COMUNE,categoria,NUMERO SCELTE,scelte espresse,scelte generiche,totale
03042930960,ASSOCIAZIONE SPORTIVA DILETTANTISTICA FANSPORT,LOMBARDIA,MI,PERO,associazioni sportive dilettantistiche,10,269.09,59.52,328.61
93043810915,ASD PROGETTO FARFALLA JUDO YAMA HARASHI NUORO,SARDEGNA,NU,NUORO,associazioni sportive dilettantistiche,10,268.96,59.52,328.48
03150350548,ASSOCIAZIONE POLISPORTIVA DILETTANTISTICA MAGIONE,UMBRIA,PG,MAGIONE,associazioni sportive dilettantistiche,12,256.52,71.42,327.94
03833640281,ASSOCIAZIONE SPORTIVA DILETTANTISTICA CAMINESE,VENETO,PD,PADOVA,associazioni sportive dilettantistiche,9,272.89,53.57,326.46
01582290191,ASSOCIAZIONE SPORTIVA DILETTANTISTICA I LEONI DI OFFANENGO,LOMBARDIA,CR,OFFANENGO,associazioni sportive dilettantistiche,11,260.92,65.47,326.39
04518670965,ASSOCIAZIONE SPORTIVA DILETTANTISTICA NEW VOLLEY ADDA,LOMBARDIA,MI,CASSANO D'ADDA,associazioni sportive dilettantistiche,10,266.85,59.52,326.37
90205460737,A.S.D. SAVA FOR VOLLEY,PUGLIA,TA,SAVA,associazioni sportive dilettantistiche,17,224.27,101.18,325.45
02127450209,ASSOCIAZIONE SPORTIVA DILETTANTISTICA MUTTI & BARTOLUCCI TENNIS CLINIC SPORTING CLUB CASTIGLIONE,LOMBARDIA,MN,CASTIGLIONE DELLE STIVIERE,associazioni sportive dilettantistiche,9,271.8,53.57,325.37
02330220548,UNIONE SPORT.DIL.CASCIA CALCIO,UMBRIA,PG,CASCIA,associazioni sportive dilettantistiche,11,259.46,65.47,324.93
91006250905,A.S.D. PALLAVOLO CAPO D'ORSO PALAU,SARDEGNA,OT,PALAU,associazioni sportive dilettantistiche,12,253.48,71.42,324.9
82002370102,YACHT CLUB SESTRI LEVANTE,LIGURIA,GE,SESTRI LEVANTE,associazioni sportive dilettantistiche,3,306.97,17.86,324.83
05455740489,EMPOLI TENNIS SCHOOL A.S.D.,TOSCANA,FI,EMPOLI,associazioni sportive dilettantistiche,9,271.14,53.57,324.71
04006740270,ASS.SPORTIVA DILETT.SCUOLA PATTINAGGIO MARCON,VENETO,VE,MARCON,associazioni sportive dilettantistiche,7,282.77,41.66,324.43
97385080151,ASSOCIAZIONE SPORTIVA CULTURALE GECO,LOMBARDIA,MI,MILANO,associazioni sportive dilettantistiche,5,294.57,29.76,324.33
90007340228,CLUB BOCCIOFILI BORGO,TRENTO,TN,BORGO VALSUGANA,associazioni sportive dilettantistiche,10,264.74,59.52,324.26
91038830864,ASSOCIAZIONE POLISPORTIVA DILETTANTISTICA CIRCOLO TENNIS ENNA E VOLOTARIATO DI PROTEZIONE CIVILE,SICILIA,EN,ENNA,associazioni sportive dilettantistiche,10,264.6,59.52,324.12
01488390228,ASSOCIAZIONE SPORTIVA DILETTANTISTICA TENNISTAVOLO LAVIS,TRENTO,TN,LAVIS,associazioni sportive dilettantistiche,13,246.69,77.37,324.06
01602440933,ASSOCIAZIONE SPORTIVA DILETTANTISTICA INSIEME PER PORDENONE,FRIULI VENEZIA GIULIA,PN,PORDENONE,associazioni sportive dilettantistiche,12,252.49,71.42,323.91
01572840096,A.S.D. ALBISSOLA 2010,LIGURIA,SV,ALBISSOLA MARINA,associazioni sportive dilettantistiche,6,288.19,35.71,323.9
93204570233,KING ROCK CLIMBING A.S.D.,VENETO,VR,VERONA,associazioni sportive dilettantistiche,5,293.75,29.76,323.51
95076520105,CENTRO STUDI KARATE LIGURIA ASD,LIGURIA,GE,CAMPOMORONE,associazioni sportive dilettantistiche,8,275.11,47.62,322.73
91273300375,SANPIETRO VOLLEY ASSOCIAZIONE DILETTANTISTICA,EMILIA ROMAGNA,BO,SAN PIETRO IN CASALE,associazioni sportive dilettantistiche,11,257.24,65.47,322.71
94220350485,"ASSOCIAZIONE SPORTIVA DILETTANTISTICA ""ENIGMADOG""",TOSCANA,FI,CALENZANO,associazioni sportive dilettantistiche,6,286.77,35.71,322.48
91038200464,A.S.D. CANOTTIERI MASSAROSA - RENZO GIUNTI,TOSCANA,LU,MASSAROSA,associazioni sportive dilettantistiche,6,286.64,35.71,322.35
97025140159,TOKIO KODOKAN MILANO,LOMBARDIA,MI,MILANO,associazioni sportive dilettantistiche,9,268.13,53.57,321.7
94533290014,ASSOCIAZIONE SPORTIVA DILETTANTISTICA A.S.D. SPORTING CLUB PINEROLO,PIEMONTE,TO,PINEROLO,associazioni sportive dilettantistiche,9,267.93,53.57,321.5
96016670638,CENTRO IPPICO LA VEGA,CAMPANIA,NA,POZZUOLI,associazioni sportive dilettantistiche,9,267.81,53.57,321.38
94002930488,A.S.D. UNIONE SPORTIVA PONTASSIEVE,TOSCANA,FI,PONTASSIEVE,associazioni sportive dilettantistiche,9,267.58,53.57,321.15
93006200013,AVIOCLUB MONTALTO,PIEMONTE,TO,MONTALTO DORA,associazioni sportive dilettantistiche,6,284.83,35.71,320.54
96057170761,A.S.D BUSHIDO KARATE CLUB PIGNOLA,BASILICATA,PZ,PIGNOLA,associazioni sportive dilettantistiche,14,237.11,83.33,320.44
02848180127,JUDO BU - SEN TRADATE,LOMBARDIA,VA,VARESE,associazioni sportive dilettantistiche,12,248.72,71.42,320.14
10162361009,A.S.D. SPORTING EUR SCUOLA CALCIO A 5,LAZIO,RM,ROMA,associazioni sportive dilettantistiche,6,283.97,35.71,319.68
97511610582,CAPITOLINA SCHERMA A.S.D.,LAZIO,RM,ROMA,associazioni sportive dilettantistiche,7,277.34,41.66,319.0
81001540236,ASSOCIAZIONE SPORTIVA DILETTANTISTICA TAMBURELLO BARDOLINO,VENETO,VR,BARDOLINO,associazioni sportive dilettantistiche,10,258.98,59.52,318.5
97039910159,SOCIETA' SPORTIVA SILENZIOSA,LOMBARDIA,MI,MILANO,associazioni sportive dilettantistiche,13,241.05,77.37,318.42
91051370863,"ASSOCIAZIONE SPORTIVA DILETTANTISTICA ""JUVENTUS CLUB DOC GAETANO SCIREA ROBERTO RANDAZZO "" PIETRAPERZIA",SICILIA,EN,PIETRAPERZIA,associazioni sportive dilettantistiche,12,246.9,71.42,318.32
02524660541,A.S.D. BICI CLUB SPOLETO,UMBRIA,PG,SPOLETO,associazioni sportive dilettantistiche,16,223.07,95.23,318.3
97497320156,A.S. DREAM TEAM MILANO ONLUS,LOMBARDIA,MI,MILANO,associazioni sportive dilettantistiche,12,246.88,71.42,318.3
01286010093,ASSOCIAZIONE SPORTIVA DILETTANTISTICA SHOBUKAI KARATE DO,LIGURIA,SV,ALBENGA,associazioni sportive dilettantistiche,13,240.54,77.37,317.91
10143081007,ASSOCIAZIONE SPORTIVA DILETTANTISTICA AMALDI TEAM VOLLEY,LAZIO,RM,ROMA,associazioni sportive dilettantistiche,6,281.47,35.71,317.18
90076700328,JUDO CLUB KEN OTANI TRIESTE,FRIULI VENEZIA GIULIA,TS,TRIESTE,associazioni sportive dilettantistiche,6,281.14,35.71,316.85
06999870725,ASSOCIAZIONE SPORTIVA DILETTANTISTICA ATLETICO PUGLIA 09,PUGLIA,BA,BARI,associazioni sportive dilettantistiche,12,245.06,71.42,316.48
96063070765,ASSOCIAZIONE CULTURALE SPORTIVA DILETTANTISTICA ATLETICO PIGNOLA 2010,BASILICATA,PZ,PIGNOLA,associazioni sportive dilettantistiche,13,239.11,77.37,316.48
90148950273,DREAM MACHINE ASSOCIAZIONE SPORTIVA DILETTANTISTICA,VENETO,VE,VENEZIA,associazioni sportive dilettantistiche,11,250.86,65.47,316.33
02511290211,ASSOCIAZIONE SPORTIVA DILETTANTISTICA PUSTERTALER TENNIS SERVICE,TRENTINO ALTO ADIGE,BZ,BRUNICO .BRUNECK.,associazioni sportive dilettantistiche,1,310.26,5.95,316.21
92019640892,ASSOCIAZIONE SPORTIVA DILETTANTISTICA NETENSIA,SICILIA,SR,NOTO,associazioni sportive dilettantistiche,5,286.38,29.76,316.14
91037390191,A.S.D. OVER LIMITS,LOMBARDIA,CR,CREMA,associazioni sportive dilettantistiche,12,244.62,71.42,316.04
02127720411,A.S.DILETT.PALLACANESTRO ACQUALA,MARCHE,PU,ACQUALAGNA,associazioni sportive dilettantistiche,7,273.89,41.66,315.55
97516360019,ASSOCIAZIONE SPORTIVA DILETTANTISTICA -BOCCIOFILA PENSIONATI PONCHIELLI,PIEMONTE,TO,TORINO,associazioni sportive dilettantistiche,11,249.93,65.47,315.4
91083430339,ASSOCIAZIONE SPORTIVA DILETTANTISTICA TUTTI IN CAMPO,EMILIA ROMAGNA,PC,PIACENZA,associazioni sportive dilettantistiche,15,226.04,89.28,315.32
03552540480,ASSOCIAZIONE SPORTIVA DILETTANTISTICA MALMANTILE,TOSCANA,FI,LASTRA A SIGNA,associazioni sportive dilettantistiche,11,249.59,65.47,315.06
90000960212,AMATEURSPORTVEREIN GITSCHBERG,TRENTINO ALTO ADIGE,BZ,RIO DI PUSTERIA .MUEHLBACH.,associazioni sportive dilettantistiche,10,255.35,59.52,314.87
02628720167,ASSOCIAZIONE SPORTIVA DILETTANTISTICA A.C. REAL BORGOGNA,LOMBARDIA,BG,PALAZZAGO,associazioni sportive dilettantistiche,12,243.1,71.42,314.52
01499750097,ASSOCIAZIONE SPORTIVA DILETTANTISTICA RUNNERS LOANO,LIGURIA,SV,LOANO,associazioni sportive dilettantistiche,10,254.91,59.52,314.43
94039970036,MONDO DANZA ASSOCIAZIONE SPORTIVA DELETTANTISTICA,PIEMONTE,NO,CAMERI,associazioni sportive dilettantistiche,9,260.18,53.57,313.75
02839460249,ASSOCIAZIONE SPORTIVA DILETTANTISTICA TAEKWONDO TEAM 2000,VENETO,VI,ARZIGNANO,associazioni sportive dilettantistiche,6,277.59,35.71,313.3
05476710016,ASSOCIAZIONE SPORTIVA DILETTANTISTICA 3S LIBERTAS LUSERNA,PIEMONTE,TO,LUSERNA SAN GIOVANNI,associazioni sportive dilettantistiche,8,265.43,47.62,313.05
91015240145,E' VALTELLINA,LOMBARDIA,SO,MORBEGNO,associazioni sportive dilettantistiche,11,247.57,65.47,313.04
94011800128,ASSOCIAZIONE DILETTANTISTICA BASKET CARONNO,LOMBARDIA,VA,CARONNO PERTUSELLA,associazioni sportive dilettantistiche,11,247.44,65.47,312.91
03273420285,THERMAL VOLLEY ABANO TERME,VENETO,PD,ABANO TERME,associazioni sportive dilettantistiche,9,258.71,53.57,312.28
90029040632,"ASSOCIAZIONE POLISPORTIVA DILETTANTISTICA ""SPORTING KARATESAMURAI""",CAMPANIA,NA,POGGIOMARINO,associazioni sportive dilettantistiche,13,234.71,77.37,312.08
01810770444,POLISPORTIVA CASTIGNANO ASS. SPORTIVA DILETTANTISTICA,MARCHE,AP,CASTIGNANO,associazioni sportive dilettantistiche,8,264.43,47.62,312.05
93119560873,ASSOCIAZIONE CULTUR.SPORT.S.MARIA DEL CARMELO GENIUS,SICILIA,CT,CATANIA,associazioni sportive dilettantistiche,18,204.7,107.13,311.83
80134990151,SOC.PERC.CAVALLO RIDING CLUB CASORATE-ASS.SPORT.DILETT.,LOMBARDIA,VA,CASORATE SEMPIONE,associazioni sportive dilettantistiche,4,287.94,23.81,311.75
91063120553,PKTR ASSOCIAZIONE SPORTIVA DILETTANTISTICA,UMBRIA,TR,TERNI,associazioni sportive dilettantistiche,9,258.12,53.57,311.69
81006740518,POLISPORTIVA BUCINESE ASSOCIAZIONE SPORTIVA DILETTANTISTICA,TOSCANA,AR,BUCINE,associazioni sportive dilettantistiche,8,263.19,47.62,310.81
91353910374,FREE DANCE ACADEMY ASSOCIAZIONE SPORTIVA DILETTANTISTICA,EMILIA ROMAGNA,BO,BARICELLA,associazioni sportive dilettantistiche,14,227.38,83.33,310.71
01809730136,ASSOCIAZIONE SPORTIVA DILETTANTISTICA SOCIETA' CANOTTIERI MENAGGIO,LOMBARDIA,CO,MENAGGIO,associazioni sportive dilettantistiche,12,239.11,71.42,310.53
01039240252,ASSOCIAZIONE DILETTANTISTICA PALLACANESTRO FONZASO,VENETO,BL,FONZASO,associazioni sportive dilettantistiche,12,238.61,71.42,310.03
03940480167,G.S. ORATORIO CORNALE - ASSOCIAZIONE SPORTIVA DILETTANTISTICA,LOMBARDIA,BG,BERGAMO,associazioni sportive dilettantistiche,7,268.29,41.66,309.95
81033230210,RENNGEMEINSCHAFT 'WIPPTAL'- AMATEURSPORTVEREIN,TRENTINO ALTO ADIGE,BZ,VIPITENO .STERZING.,associazioni sportive dilettantistiche,9,256.03,53.57,309.6
94145910546,"ASSOCIAZIONE CULTURALE SPORTIVA DILETTANTISTICA ""NATURALMENTE DANZA""",UMBRIA,PG,PERUGIA,associazioni sportive dilettantistiche,11,243.88,65.47,309.35
04134710401,ASD LA BALENA,EMILIA ROMAGNA,FC,FORLI',associazioni sportive dilettantistiche,8,261.44,47.62,309.06
94013140036,STUDIO DANZA NOVARA A.S.D.,PIEMONTE,NO,NOVARA,associazioni sportive dilettantistiche,8,261.37,47.62,308.99
84033820485,GRUPPO SPORTIVO MEZZANA ASD,TOSCANA,PO,PRATO,associazioni sportive dilettantistiche,7,267.22,41.66,308.88
92054640468,"A.S.D. ""PODISTICA S. PANCRAZIO""",TOSCANA,LU,LUCCA,associazioni sportive dilettantistiche,10,247.61,59.52,307.13
93048680198,ASD CREMONA RUGBY,LOMBARDIA,CR,CASALBUTTANO ED UNITI,associazioni sportive dilettantistiche,11,241.27,65.47,306.74
94220030483,A.S.D. WHEELCHAIR DANCE FIRENZE - CENTRO TOSCANO DANZA INTEGRATA,TOSCANA,FI,FIRENZE,associazioni sportive dilettantistiche,12,235.32,71.42,306.74
01722900121,VALBOSSA VOLLEY ASSOC.SPORTIVA DILETT,LOMBARDIA,VA,AZZATE,associazioni sportive dilettantistiche,7,264.99,41.66,306.65
02233530357,SCUOLA CALCIO SARZANO,EMILIA ROMAGNA,RE,CASINA,associazioni sportive dilettantistiche,13,229.28,77.37,306.65
02144170285,VOLLEY BALL TOMBOLO ASSOCIAZIONE SPORTIVA DILETTANTISTICA,VENETO,PD,TOMBOLO,associazioni sportive dilettantistiche,16,211.29,95.23,306.52
01649660477,POLISPORTIVA VALDINIEVOLE RUGBY ASSOCIAZIONE DILETTANTISTICA,TOSCANA,PT,UZZANO,associazioni sportive dilettantistiche,7,264.84,41.66,306.5
01158770071,A.S.D. CHEVAL D'AOSTE,VALLE D'AOSTA,AO,LA THUILE,associazioni sportive dilettantistiche,4,282.68,23.81,306.49
90114750277,A.S.D. SPORT NAZIONALE,VENETO,VE,VENEZIA,associazioni sportive dilettantistiche,10,246.58,59.52,306.1
09506250019,EVER GREEN TWIRLING CLUB ASSOCIAZIONE SPORTIVA DILETTANTISTICA,PIEMONTE,TO,COLLEGNO,associazioni sportive dilettantistiche,10,246.48,59.52,306.0
02181890746,ASSOCIAZIONE SPORTIVA DILETTANTISTICA UNIONE SPORTIVA S. PIETRO,PUGLIA,BR,SAN PIETRO VERNOTICO,associazioni sportive dilettantistiche,9,252.32,53.57,305.89
94061620038,PALLACANESTRO BORGOTICINO A.S.D.,PIEMONTE,NO,BORGO TICINO,associazioni sportive dilettantistiche,9,251.71,53.57,305.28
09675621008,A.S.D. BASKET CASTORO,LAZIO,RM,ANZIO,associazioni sportive dilettantistiche,10,245.7,59.52,305.22
90006460019,LA LESA - SCI CLUB,PIEMONTE,TO,PINO TORINESE,associazioni sportive dilettantistiche,8,257.59,47.62,305.21
01724630163,CENTRO GIOVANILE BOCCALEONE PALLAVOLO ASSOCIAZIONE SPORTIVA DILETTANTISTICA,LOMBARDIA,BG,BERGAMO,associazioni sportive dilettantistiche,11,239.51,65.47,304.98
03730400615,A.S.D. GIO.RI. CAIAZZO,CAMPANIA,CE,CAIAZZO,associazioni sportive dilettantistiche,17,203.12,101.18,304.3
84006960300,SOCIETA' SPORTIVA DILETTANTISTICA PONTEBBANA,FRIULI VENEZIA GIULIA,UD,PONTEBBA,associazioni sportive dilettantistiche,12,232.7,71.42,304.12
92248740281,A.S.C.D. UNIONE LOREGGIANA,VENETO,PD,LOREGGIA,associazioni sportive dilettantistiche,14,220.52,83.33,303.85
91000360205,ASSOCIAZIONE SPORTIVA POLISPORTIVA DILETTANTISTICA MOGLIESE,LOMBARDIA,MN,MOGLIA,associazioni sportive dilettantistiche,5,274.01,29.76,303.77
97606840011,POLISPORTIVA SANTA GIULIA,PIEMONTE,TO,TORINO,associazioni sportive dilettantistiche,8,256.11,47.62,303.73
04073710487,ASSOCIAZIONE SPORTIVA DILETTANTISTICA ATLETICA FUCECCHIO,TOSCANA,FI,FUCECCHIO,associazioni sportive dilettantistiche,8,255.54,47.62,303.16
06982550011,ASSOCIAZIONE DILETTANTISTICA PALLAVOLO SANTENA 95,PIEMONTE,TO,SANTENA,associazioni sportive dilettantistiche,10,242.91,59.52,302.43
92029940415,ASSOCIAZIONE SPORTIVA DILETTANTISTICA SNOOPY PALLAVOLO PESARO,MARCHE,PU,PESARO,associazioni sportive dilettantistiche,10,242.45,59.52,301.97
93005000257,ASSOCIAZIONE SPORTIVA DILETTANTISTICA TENNIS CLUB SEDICO,VENETO,BL,SEDICO,associazioni sportive dilettantistiche,10,242.13,59.52,301.65
02221990985,LIBERTAS DANZA GINNASTICA SALO'-ASSOC. ART. DILETTANT.,LOMBARDIA,BS,SALO',associazioni sportive dilettantistiche,9,248.05,53.57,301.62
01903540662,ASD VIRTUS PRATOLA CALCIO,ABRUZZO,AQ,PRATOLA PELIGNA,associazioni sportive dilettantistiche,15,211.38,89.28,300.66
06018510013,ASSOCIAZIONE KOLBE,PIEMONTE,TO,TORINO,associazioni sportive dilettantistiche,6,264.77,35.71,300.48
01934720267,ASSOCIAZIONE SPORTIVA DILETTANTISTICA PALLACANESTRO VITTORIO VENETO,VENETO,TV,VITTORIO VENETO,associazioni sportive dilettantistiche,11,234.67,65.47,300.14
04012660231,A.S.D. PLAY SPORT,VENETO,VR,LEGNAGO,associazioni sportive dilettantistiche,8,252.2,47.62,299.82
92003620835,ASSOCIAZIONE SPORTIVA DILETTANTISTICA BUSHIDO KARATE,SICILIA,ME,PACE DEL MELA,associazioni sportive dilettantistiche,13,222.36,77.37,299.73
01788130464,ART & DANZA ARABESQUE,TOSCANA,LU,LUCCA,associazioni sportive dilettantistiche,11,234.01,65.47,299.48
94137580547,BASKET BASTIA ASD,UMBRIA,PG,BASTIA UMBRA,associazioni sportive dilettantistiche,12,228.01,71.42,299.43
97037100159,ASSOCIAZIONE SPORTIVA DILETTANTISTICA CENTRO SPORTIVO CORSICO,LOMBARDIA,MI,CORSICO,associazioni sportive dilettantistiche,9,245.44,53.57,299.01
80014790309,U.S.D. TORREANESE,FRIULI VENEZIA GIULIA,UD,TORREANO,associazioni sportive dilettantistiche,9,245.37,53.57,298.94
90066960635,"ASSOCIAZIONE SPORTIVA DILETTANTISTICA "" I CAVALIERI """,CAMPANIA,NA,TRECASE,associazioni sportive dilettantistiche,13,221.11,77.37,298.48
00880300256,ASS. SPORTIVA DILETTANTISTICA A.C.D. LONGARONE,VENETO,BL,LONGARONE,associazioni sportive dilettantistiche,10,238.82,59.52,298.34
91006270812,ASD MAZARA ASSOCIAZIONE SPORTIVA DILETTANTISTICA,SICILIA,TP,MAZARA DEL VALLO,associazioni sportive dilettantistiche,14,214.8,83.33,298.13
01277700496,A.S.D. CANOA CLUB LIVORNO,TOSCANA,LI,COLLESALVETTI,associazioni sportive dilettantistiche,10,238.32,59.52,297.84
91025900472,SCI CLUB SOTTOZERO,TOSCANA,PT,MONTECATINI TERME,associazioni sportive dilettantistiche,6,262.12,35.71,297.83
81009700360,POLISPORTIVA ROVERETANA ASSOCIAZIONE SPORTIVA DILETTANTISTIC,EMILIA ROMAGNA,MO,NOVI DI MODENA,associazioni sportive dilettantistiche,13,220.05,77.37,297.42
90015020291,ASSOCIAZIONE SPORTIVA DILETTANTISTICA CULTURALE ARTALIDE,VENETO,RO,ADRIA,associazioni sportive dilettantistiche,6,261.67,35.71,297.38
02026270237,U.S. SAN MARCO BORGO MILANO A.S.D.,VENETO,VR,VERONA,associazioni sportive dilettantistiche,7,255.54,41.66,297.2
94014430261,SEZIONE TERRITORIALE FIAS DI TREVISO,VENETO,TV,VILLORBA,associazioni sportive dilettantistiche,8,248.93,47.62,296.55
96360010589,"ASS.SPORTIVA DILETTANTISTICA ""QUATTRO TORRI""",LAZIO,RM,POMEZIA,associazioni sportive dilettantistiche,12,224.86,71.42,296.28
02755450216,MEDER DH CLUB GHERDEINA ASSOCIAZIONE SPORTIVA DILETTANTISTICA,TRENTINO ALTO ADIGE,BZ,SELVA DI VAL GARDENA .WOLKENSTEIN IN GRO,associazioni sportive dilettantistiche,4,272.25,23.81,296.06
92024280379,POLISPORTIVA SPORT 2000 ASSOCIAZIONE DILETTANTISTICA,EMILIA ROMAGNA,BO,SAN LAZZARO DI SAVENA,associazioni sportive dilettantistiche,7,254.14,41.66,295.8
91004440532,ENTE PALIO MARINARO DELL'ARGENTARIO,TOSCANA,GR,MONTE ARGENTARIO,associazioni sportive dilettantistiche,7,253.81,41.66,295.47
01668780495,ASSOCIAZIONE SPORTIVA DILETTANTISTICA DONORATICO VOLLEY,TOSCANA,LI,CASTAGNETO CARDUCCI,associazioni sportive dilettantistiche,14,212.09,83.33,295.42
94056070306,ASSOCIAZIONE SPORTIVA DILETTANTISTICA DRAGHI FOOTBALL UDINE,FRIULI VENEZIA GIULIA,UD,UDINE,associazioni sportive dilettantistiche,10,235.79,59.52,295.31
80018300220,U.S. LAVIS A.S.D.,TRENTO,TN,LAVIS,associazioni sportive dilettantistiche,11,229.83,65.47,295.3
00733390520,PALLAVOLO RAPOLANO ASSOCIAZIONE SPORTIVA DILETTANTISTICA,TOSCANA,SI,RAPOLANO TERME,associazioni sportive dilettantistiche,10,235.32,59.52,294.84
02076790241,A.S.D. VICENZA CALCIO FEMMINILE,VENETO,VI,VICENZA,associazioni sportive dilettantistiche,14,211.43,83.33,294.76
03326310921,NORBIO ASSOCIAZIONE SPORTIVA DILETTANTISTICA,SARDEGNA,VS,VILLACIDRO,associazioni sportive dilettantistiche,13,216.28,77.37,293.65
96052750765,A.S.D. SOCIETA' GRUPPO SPORTIVO E CULTURALE SILENZIOSI,BASILICATA,PZ,POTENZA,associazioni sportive dilettantistiche,17,192.16,101.18,293.34
00987720091,VELOCE FBC 1910,LIGURIA,SV,SAVONA,associazioni sportive dilettantistiche,5,263.58,29.76,293.34
02027800719,A.S.D. GRUPPO SPORTIVO ARPI PATTINATORI,PUGLIA,FG,FOGGIA,associazioni sportive dilettantistiche,10,233.6,59.52,293.12
03936000284,AURORA MONTEGROTTO ASSOCIAZIONE SPORTIVA DILETTANTISTICA,VENETO,PD,MONTEGROTTO TERME,associazioni sportive dilettantistiche,14,209.16,83.33,292.49
92031420372,POLISPORTIVA CSI CASALECCHIO ASSOCIAZIONE SPORTIVA DILETTANTISTICA,EMILIA ROMAGNA,BO,CASALECCHIO DI RENO,associazioni sportive dilettantistiche,12,220.83,71.42,292.25
07371290011,CIRCOLO PORTA SUSA A.S.D.,PIEMONTE,TO,TORINO,associazioni sportive dilettantistiche,6,255.46,35.71,291.17
00443970314,UNIONE SPORTIVA DILETTANTISTICA PALLAVOLO ACLI RONCHI,FRIULI VENEZIA GIULIA,GO,RONCHI DEI LEGIONARI,associazioni sportive dilettantistiche,12,219.3,71.42,290.72
91022680929,ASSOCIAZIONE SPORTIVA DILETTANTISTICA DELFINO SPORT,SARDEGNA,VS,SAN GAVINO MONREALE,associazioni sportive dilettantistiche,8,242.25,47.62,289.87
92035800884,ASSOCIAZIONE SPORTIVA DILETTANTISTICA PROGETTO FILIPPIDE RAGUSA,SICILIA,RG,RAGUSA,associazioni sportive dilettantistiche,8,242.07,47.62,289.69
95015190168,"ASSOCIAZIONE SPORTIVA ""OROBICA GINNASTICA""",LOMBARDIA,BG,BERGAMO,associazioni sportive dilettantistiche,3,271.39,17.86,289.25
92013570236,ASS. SPORTIVA EQUESTRE DILETTANTISTICA LA FENICE,VENETO,VR,SAN MARTINO BUON ALBERGO,associazioni sportive dilettantistiche,5,259.06,29.76,288.82
93040090636,ASSOCIAZIONE SPORTIVA DILETTANTISTICA PHOENIX CAIVANO,CAMPANIA,NA,CAIVANO,associazioni sportive dilettantistiche,12,217.34,71.42,288.76
01798710503,C.F. SCALESE ASSOC.SPORT.DILETT.,TOSCANA,PI,SAN MINIATO,associazioni sportive dilettantistiche,7,247.09,41.66,288.75
85005690012,ASC CUMIANA - ASSOCIAZIONE CALCIO MASCHILE E FEMMINILE CUMIANA,PIEMONTE,TO,CUMIANA,associazioni sportive dilettantistiche,11,223.19,65.47,288.66
92020840754,"""POLISPORTIVA PRO LOCO FARNESE NOCIGLIA ASSOCIAZIONE SPORTIVA DILETTANTISTICA""",PUGLIA,LE,NOCIGLIA,associazioni sportive dilettantistiche,7,246.87,41.66,288.53
94046350487,ASSOCIAZIONE SPORTIVA DILETTANTISTICA GINNASTICA IL POGGETTO,TOSCANA,FI,FIRENZE,associazioni sportive dilettantistiche,10,228.86,59.52,288.38
02252010463,A.S.D.GINNASTICA RITMICA ALBACHIARA,TOSCANA,LU,LUCCA,associazioni sportive dilettantistiche,11,222.89,65.47,288.36
92093520093,PASSODANZA ASD,LIGURIA,SV,SAVONA,associazioni sportive dilettantistiche,4,264.5,23.81,288.31
91029180477,G.S.D. RUN.DAGI,TOSCANA,PT,BUGGIANO,associazioni sportive dilettantistiche,11,222.54,65.47,288.01
00447000555,A.S.D. G.M. 10,UMBRIA,TR,GUARDEA,associazioni sportive dilettantistiche,9,234.33,53.57,287.9
01473680062,POLISPORTIVA DERTHONA GINNASTICA ASSOCIAZIONE SPORTIVA DILETTANTISTICA,PIEMONTE,AL,TORTONA,associazioni sportive dilettantistiche,14,204.38,83.33,287.71
01738520665,ASSOCIAZIONE SPORTIVA DILETTANTISTICA MARCELLO CECI,ABRUZZO,AQ,PIZZOLI,associazioni sportive dilettantistiche,5,257.9,29.76,287.66
02157240132,CLUB SPORTIVO ALBA ASSOCIAZIONE SPORTIVA DILETTANTISTICA,LOMBARDIA,CO,ALBESE CON CASSANO,associazioni sportive dilettantistiche,7,245.62,41.66,287.28
01081630293,ASSOCIAZIONE RUGBY JUNIOR BADIA,VENETO,RO,BADIA POLESINE,associazioni sportive dilettantistiche,7,245.6,41.66,287.26
02803430988,"ASSOCIAZIONE SPORTIVA DILETTANTISTICA ""CIRCOLO SCACCHI GHEDI""",LOMBARDIA,BS,GHEDI,associazioni sportive dilettantistiche,3,269.36,17.86,287.22
05125560481,CENTRO KARATE SHOTOKAN POLISPORTIVA CERTALDO,TOSCANA,FI,CERTALDO,associazioni sportive dilettantistiche,12,215.52,71.42,286.94
91026240100,ASSOCIAZIONE SPORTIVA DILETTANTISTICA VOLLEY USCIO,LIGURIA,GE,USCIO,associazioni sportive dilettantistiche,8,239.15,47.62,286.77
94544220158,ASSOCIAZIONE DILETTANTISTICA VOLLEY BIASSONO,LOMBARDIA,MB,BIASSONO,associazioni sportive dilettantistiche,9,233.05,53.57,286.62
91259080371,ASSOCIAZIONE SPORTIVA DILETTANTISTICA MAIOR TENNISTAVOLO,EMILIA ROMAGNA,BO,CASTEL MAGGIORE,associazioni sportive dilettantistiche,8,238.81,47.62,286.43
01347120527,A.S.D. SPORTING G.A.U. ARBIA,TOSCANA,SI,ASCIANO,associazioni sportive dilettantistiche,10,226.25,59.52,285.77
02290380696,GOBLINS AFT ASSOCIAZIONE SPORTIVA DILETTANTISTICA,ABRUZZO,CH,SAN VITO CHIETINO,associazioni sportive dilettantistiche,10,226.08,59.52,285.6
02574270241,SANDRIGO HOCKEY A.S.D.,VENETO,VI,SANDRIGO,associazioni sportive dilettantistiche,12,213.89,71.42,285.31
90023560858,"POLISPORTIVA "" SANTA MARIA "" A.S.D.",SICILIA,CL,NISCEMI,associazioni sportive dilettantistiche,19,170.96,113.09,284.05
02271320208,ASSOCIAZIONE SPORTIVA DILETTANTISTICA S.EGIDIO E S.PIO X,LOMBARDIA,MN,MANTOVA,associazioni sportive dilettantistiche,10,224.48,59.52,284.0
02121160481,ASS. GRUPPO SPORTIVO DILETTANTISTICO FLORIAGAFIR BELLARIVA,TOSCANA,FI,FIRENZE,associazioni sportive dilettantistiche,12,212.44,71.42,283.86
95067780122,ARMONIA ASSOCIAZIONE SPORTIVA DILETTANTISTICA,LOMBARDIA,VA,MALNATE,associazioni sportive dilettantistiche,10,223.57,59.52,283.09
02178870461,A.S.D. NUOVE PANTERE LUCCA 2009,TOSCANA,LU,LUCCA,associazioni sportive dilettantistiche,8,235.32,47.62,282.94
91012580055,ASSOCIAZIONE DILETTANTISTICA POLISPORTIVA CASTAGNOLESE ASD,PIEMONTE,AT,CASTAGNOLE DELLE LANZE,associazioni sportive dilettantistiche,9,229.34,53.57,282.91
02495370344,AS.D. TENNISTAVOLO S.POLO,EMILIA ROMAGNA,PR,TORRILE,associazioni sportive dilettantistiche,8,234.55,47.62,282.17
00928870435,ATLETICA MONTECASSIANO ASS.NE SPORTIVA DILETTANTISTICA,MARCHE,MC,MONTECASSIANO,associazioni sportive dilettantistiche,16,186.46,95.23,281.69
01542990476,ASSOCIAZIONE SPORTIVA DILETTANTISTICA CULTURALE MISERICORDIA DI PISTOIA SEZ. PESCA,TOSCANA,PT,PISTOIA,associazioni sportive dilettantistiche,11,216.13,65.47,281.6
90015620330,WOLF'S SWIMMER,EMILIA ROMAGNA,PC,CASTELL'ARQUATO,associazioni sportive dilettantistiche,6,245.87,35.71,281.58
92017300903,A.S.D. SCUOLA ADDESTRAMENTO ALLA PALLACANESTRO,SARDEGNA,SS,ALGHERO,associazioni sportive dilettantistiche,11,215.51,65.47,280.98
90014500855,"ASSOCIAZIONE POLISPORTIVA DILETTANTISTICA ""RIESI 2002""",SICILIA,CL,RIESI,associazioni sportive dilettantistiche,9,227.34,53.57,280.91
92130310904,MARTIAL ARTS SCHOOL ASD,SARDEGNA,SS,PORTO TORRES,associazioni sportive dilettantistiche,12,209.0,71.42,280.42
95081650160,ASSOCIAZIONE SPORTIVA DILETTANTISTICA YAMATO DAMASHII BERGAMO,LOMBARDIA,BG,BERGAMO,associazioni sportive dilettantistiche,11,214.34,65.47,279.81
03218430282,ASSOCIAZIONE SPORTIVA DILETTANTISTICA POLISPORTIVA WADOKAI TREBASELEGHE,VENETO,PD,TREBASELEGHE,associazioni sportive dilettantistiche,8,232.07,47.62,279.69
90027350504,ASSOCIAZIONE SPORTIVA DILETTANTISTICA FOOTBALL CLUB FORNACETTE CASAORSA,TOSCANA,PI,CALCINAIA,associazioni sportive dilettantistiche,7,237.66,41.66,279.32
01112030430,ASD CANTINE RIUNITE CSI,MARCHE,MC,TOLENTINO,associazioni sportive dilettantistiche,12,207.8,71.42,279.22
91032950379,ASSOCIAZIONE SPORTIVA DILETTANTISTICA TROTTOLA SPORT,EMILIA ROMAGNA,BO,PORRETTA TERME,associazioni sportive dilettantistiche,11,213.64,65.47,279.11
80014450334,ASSOCIAZIONE SPORTIVA SAN POLO,EMILIA ROMAGNA,PC,PODENZANO,associazioni sportive dilettantistiche,7,237.2,41.66,278.86
92177910921,ASD SARDEGNATTIVA,SARDEGNA,CA,CAGLIARI,associazioni sportive dilettantistiche,10,219.0,59.52,278.52
95147950166,UNIONE SPORTIVA GAVERINA TERME ANGELO FARINOTTI ASSOCIAZIONE SPORTIVA DILETTA,LOMBARDIA,BG,GAVERINA TERME,associazioni sportive dilettantistiche,7,236.32,41.66,277.98
83011760135,A.S.PREMANA ASSOCIAZIONE SPORT IVA DILETTANTISTICA,LOMBARDIA,LC,PREMANA,associazioni sportive dilettantistiche,12,206.34,71.42,277.76
