CODICE FISCALE,DENOMINAZIONE,REGIONE,PROVINCIA,COMUNE,categoria,NUMERO SCELTE,scelte espresse,scelte generiche,totale
04014320263,NUOVO PATTINAGGIO ODERZO - ASSOCIAZIONE SPORTIVA DILETTANTISTICA,VENETO,TV,ODERZO,associazioni sportive dilettantistiche,25,790.23,148.8,939.03
91000260454,VELO CLUB CARRARA ASD,TOSCANA,MS,CARRARA,associazioni sportive dilettantistiche,32,748.52,190.46,938.98
97590210585,MARTIAL ARTS RAMOS SCHOOL,LAZIO,RM,ROMA,associazioni sportive dilettantistiche,20,819.38,119.04,938.42
05106250870,ASSOCIAZIONE SPORTIVA DILETTANTISTICA ASD JONIA BASKET,SICILIA,CT,GIARRE,associazioni sportive dilettantistiche,28,771.61,166.65,938.26
06292041008,ASSOCIAZIONE C.S. KOLBE PONTEMAMMOLO,LAZIO,RM,ROMA,associazioni sportive dilettantistiche,34,735.39,202.36,937.75
95007780240,ASS SPORTIVA DILETTANTISTICA PALLAVOLO ALTAVILLA,VENETO,VI,ALTAVILLA VICENTINA,associazioni sportive dilettantistiche,14,853.09,83.33,936.42
81008160392,A.S.D. BRISIGHELLA VAL LAMONE,EMILIA ROMAGNA,RA,BRISIGHELLA,associazioni sportive dilettantistiche,34,733.96,202.36,936.32
82013480270,ASSOCIAZIONE POLISPORTIVA VIS FAVARO-VENETO,VENETO,VE,VENEZIA,associazioni sportive dilettantistiche,30,757.16,178.56,935.72
80024600217,ASSOCIAZIONE SPORTIVA DILETTANTISTICA CENTRO STUDI ARTI MARZIALI C S A M JUDOJO,TRENTINO ALTO ADIGE,BZ,BRONZOLO .BRANZOLL.,associazioni sportive dilettantistiche,7,893.17,41.66,934.83
90040070329,ASS. SPORTIVA DILETTANTISTICA AMATERSKO SPORTNO DRUSTVO SK BRDINA,FRIULI VENEZIA GIULIA,TS,TRIESTE,associazioni sportive dilettantistiche,16,839.4,95.23,934.63
01446780338,A.S.D. PALLAVOLO SAN GIORGIO,EMILIA ROMAGNA,PC,SAN GIORGIO PIACENTINO,associazioni sportive dilettantistiche,32,743.88,190.46,934.34
95005700018,ASSOC. SPORTIVA DILETT. CENTRO ATTIVITA' SUBACQUE EXPLORER,PIEMONTE,TO,RIVAROLO CANAVESE,associazioni sportive dilettantistiche,16,838.82,95.23,934.05
80445000583,ASD POLISPORTIVA CASTELVERDE,LAZIO,RM,ROMA,associazioni sportive dilettantistiche,30,755.16,178.56,933.72
01552730333,GRUPPO SPORTIVO PARROCCHIALE ORATORIO SAN FILIPPO NERI ASSOCIAZIONE SPORTIVA DILETTANTISTICA,EMILIA ROMAGNA,PC,CASTEL SAN GIOVANNI,associazioni sportive dilettantistiche,26,778.95,154.75,933.7
96047610066,ASSOCIAZIONE SPORTIVA DILETTANTISTICA YUME ALESSANDRIA,PIEMONTE,AL,ALESSANDRIA,associazioni sportive dilettantistiche,37,712.88,220.22,933.1
01262330747,HOCKEY CLUB OLIMPIA DILETTANTISTICA,PUGLIA,BR,TORRE SANTA SUSANNA,associazioni sportive dilettantistiche,34,729.48,202.36,931.84
01885130516,"SOCIETA' GINNASTICA ""TERRANUOVA"" ASSOCIAZIONE SPORTIVA DILETTANTISTICA",TOSCANA,AR,TERRANUOVA BRACCIOLINI,associazioni sportive dilettantistiche,19,818.21,113.09,931.3
90017610073,ASSOCIAZIONE SPORTIVA DILLET. CLUB DE SKI VALTOURNENCHE,VALLE D'AOSTA,AO,VALTOURNENCHE,associazioni sportive dilettantistiche,13,853.24,77.37,930.61
04399090283,A.C.D. CARMENTA,VENETO,PD,CARMIGNANO DI BRENTA,associazioni sportive dilettantistiche,24,787.4,142.85,930.25
97276840820,STELLA BASKET PALERMO A.S.D.,SICILIA,PA,PALERMO,associazioni sportive dilettantistiche,18,821.05,107.13,928.18
92081560283,ASSOCIAZIONE SPORTIVA DILETTANTISTICA SELVAZZANO BASKET,VENETO,PD,SELVAZZANO DENTRO,associazioni sportive dilettantistiche,25,778.97,148.8,927.77
06404510155,A.C. MACALLESI 1927 ASSOCIAZIONE SPORTIVA DILETTANTISTICA,LOMBARDIA,MI,MILANO,associazioni sportive dilettantistiche,17,826.53,101.18,927.71
05537660481,POLISPORTIVA REALCERRETESE ASSOCIAZIONE SPORTIVA DILETTANTISTICA,TOSCANA,FI,CERRETO GUIDI,associazioni sportive dilettantistiche,8,879.28,47.62,926.9
01877810125,VELO CLUB SOMMESE,LOMBARDIA,VA,SOMMA LOMBARDO,associazioni sportive dilettantistiche,30,748.28,178.56,926.84
93044540206,NEW WELLNESS ASSOC.SPORT.DILETT.,LOMBARDIA,MN,MANTOVA,associazioni sportive dilettantistiche,19,813.4,113.09,926.49
00708350525,SSOCIAZIONE SPORTIVA DILETTANTISTICA FIDES TORRITA,TOSCANA,SI,TORRITA DI SIENA,associazioni sportive dilettantistiche,43,670.28,255.93,926.21
93121860428,ASSOCIAZIONE SPORTIVA DILETTANTISTICA CONERO SPORT,MARCHE,AN,SIROLO,associazioni sportive dilettantistiche,33,729.8,196.41,926.21
91001440352,PALLACANESTRO CORREGGIO ASSOCIAZIONE SPORTIVA DILE,EMILIA ROMAGNA,RE,CORREGGIO,associazioni sportive dilettantistiche,19,812.88,113.09,925.97
00906850433,ASSOCIAZIONE POLISPORTIVA DILETTANTISTICA JUVENILIA,MARCHE,MC,POLLENZA,associazioni sportive dilettantistiche,32,735.42,190.46,925.88
94100390262,CIRCOLO SCHERMA CASTELFRANCO V.TO -ASSOCIAZIONE SPORTIVA DILETTANTISTICA,VENETO,TV,CASTELFRANCO VENETO,associazioni sportive dilettantistiche,19,812.72,113.09,925.81
92015320010,"A.S.D. LIBERTAS ""VIVA"" DI BORGARO",PIEMONTE,TO,TORINO,associazioni sportive dilettantistiche,29,753.01,172.61,925.62
92043470134,GRUPPO SPORTIVO ORATORIO LAORCA ASD,LOMBARDIA,LC,LECCO,associazioni sportive dilettantistiche,24,782.75,142.85,925.6
91099170598,TERRACINA VELA CLUB ASSOCIAZIONE SPORTIVA DILETTANTISTICA,LAZIO,LT,TERRACINA,associazioni sportive dilettantistiche,21,799.57,124.99,924.56
07541560962,RUGBY LODI ASSOCIAZIONE SPORTIVA DILETTANTISTICA,LOMBARDIA,LO,LODI,associazioni sportive dilettantistiche,20,805.34,119.04,924.38
03070870542,ASSOCIAZIONE SPORTIVA DILETTANTISTICA ATHLETIC TEAM PERUGIA,UMBRIA,PG,CORCIANO,associazioni sportive dilettantistiche,29,751.39,172.61,924.0
80104040391,CIRCOLO NAUTICO DEL SAVIO-ASSOCI,EMILIA ROMAGNA,FC,FORLI',associazioni sportive dilettantistiche,17,822.38,101.18,923.56
91003470357,ASSOCIAZIONE SPORTIVA COOPERATORI UNIPOL,EMILIA ROMAGNA,RE,REGGIO NELL'EMILIA,associazioni sportive dilettantistiche,30,744.95,178.56,923.51
97539310017,ASSOCIAZIONE PIEMONTESE CORRIDORI CICLISTI,PIEMONTE,TO,TORINO,associazioni sportive dilettantistiche,24,779.59,142.85,922.44
04163500269,ASSOCIAZIONE CALCIO CASIER DOSSON ASSOCIAZIONE SPORTIVA DILETTANTISTICA,VENETO,TV,CASIER,associazioni sportive dilettantistiche,20,802.93,119.04,921.97
90015970206,KARATEMANTOVA ASSOCIAZIONE SPORTIVA DILETTANTISTICA,LOMBARDIA,MN,GOITO,associazioni sportive dilettantistiche,33,724.75,196.41,921.16
01405910991,USD AMICIZIA LAGACCIO,LIGURIA,GE,GENOVA,associazioni sportive dilettantistiche,18,813.83,107.13,920.96
07650240018,ONLUS AGIEF ASS.SPORT.DILETTANT.,PIEMONTE,TO,TORINO,associazioni sportive dilettantistiche,29,747.21,172.61,919.82
02835690120,CLUB AMICI DELLO SPORT SEZIONE CALCIO,LOMBARDIA,VA,BUSTO ARSIZIO,associazioni sportive dilettantistiche,37,699.55,220.22,919.77
00829080092,VADO FC 1913,LIGURIA,SV,QUILIANO,associazioni sportive dilettantistiche,29,746.94,172.61,919.55
80055640231,ASSOCIAZ. SPORTIVA DILETT. POLISPORTIVA BORGO TRENTO,VENETO,VR,VERONA,associazioni sportive dilettantistiche,18,811.96,107.13,919.09
82005690399,SOC.CICLISTICA FRANCESCO BARACCA,EMILIA ROMAGNA,RA,LUGO,associazioni sportive dilettantistiche,24,775.59,142.85,918.44
03567590264,EZZELINA VOLLEY CARINATESE A.S.D.,VENETO,TV,SAN ZENONE DEGLI EZZELINI,associazioni sportive dilettantistiche,30,739.59,178.56,918.15
01837960507,A.S.D. GINNASTICA TICA,TOSCANA,PI,CRESPINA LORENZANA,associazioni sportive dilettantistiche,34,715.72,202.36,918.08
90054800728,ASSOCIAZIONE SPORTIVA DILETTANTISTICA MANZONI SPORT,PUGLIA,BT,ANDRIA,associazioni sportive dilettantistiche,20,798.87,119.04,917.91
97224760153,A.S. PALLAVOLO GONZAGA GIOVANI,LOMBARDIA,MI,MILANO,associazioni sportive dilettantistiche,12,846.29,71.42,917.71
93030820810,A.S.C.D. NUMBER ONE,SICILIA,TP,TRAPANI,associazioni sportive dilettantistiche,40,679.4,238.08,917.48
91033020248,SBALLANDO BALLANDO ASSOCIAZIONE SPORTIVA DILETTANTISTICA,VENETO,VI,ROMANO D'EZZELINO,associazioni sportive dilettantistiche,18,809.67,107.13,916.8
01329150625,SCUOLA CALCIO VALLE TELESINA-TELESE TERME SOC. SPORT. DILETT.,CAMPANIA,BN,TELESE TERME,associazioni sportive dilettantistiche,27,755.85,160.7,916.55
90014460654,AGROPOLI ORIENTEERING KLUBB ASSOCIAZIONE SPORTIVA DILETTANTISTICA,CAMPANIA,SA,AGROPOLI,associazioni sportive dilettantistiche,11,850.23,65.47,915.7
86008750159,SPORTIVA ORATORIANA INVERUNESE ASSOCIAZIONE SPORTIVA DILETTANTISTICA,LOMBARDIA,MI,INVERUNO,associazioni sportive dilettantistiche,24,772.62,142.85,915.47
92088680928,A.S.D. G.S. RUNNERS CAGLIARI,SARDEGNA,CA,CAGLIARI,associazioni sportive dilettantistiche,17,813.72,101.18,914.9
06368580962,ASSOCIAZIONE SPORTIVA DILETTANTISTICA TRAINING TEAM,LOMBARDIA,MI,MILANO,associazioni sportive dilettantistiche,10,855.01,59.52,914.53
97616940157,ASD SESTO 2012,LOMBARDIA,MI,SESTO SAN GIOVANNI,associazioni sportive dilettantistiche,27,753.53,160.7,914.23
91015630675,CIRCOLO VELICO AMICI DA MARE ASD,ABRUZZO,TE,MARTINSICURO,associazioni sportive dilettantistiche,21,789.1,124.99,914.09
93004580150,A.S.D. ARCIERI TRE TORRI - CARDANO AL CAMPO,LOMBARDIA,VA,CARDANO AL CAMPO,associazioni sportive dilettantistiche,22,782.7,130.94,913.64
90032620370,G.S. PATTINAGGIO CASTELLANO ASSOCIAZIONE SPORTIVA DILETTANTISTICA,EMILIA ROMAGNA,BO,CASTEL SAN PIETRO TERME,associazioni sportive dilettantistiche,16,818.16,95.23,913.39
12541920158,NEW VOLLEY VIZZOLO ASSOCIAZIONE SPORTIVA DILETTANTISTICA,LOMBARDIA,LO,MULAZZANO,associazioni sportive dilettantistiche,22,782.25,130.94,913.19
01473420097,ASSOCIAZIONE SPORTIVA DILETTANTISTICA PIRATES 1984,LIGURIA,SV,SAVONA,associazioni sportive dilettantistiche,25,764.32,148.8,913.12
97077230155,VIRTUS PALLAVOLO,LOMBARDIA,PV,CASORATE PRIMO,associazioni sportive dilettantistiche,20,794.0,119.04,913.04
03719720371,A.C. TOZZONA-PEDAGNA ASSOCIAZIONE SPORTIVA DILETTANTISTICA,EMILIA ROMAGNA,BO,IMOLA,associazioni sportive dilettantistiche,29,740.21,172.61,912.82
01287850760,SOCIETA' SPORTIVA SANTARCANGIOLESE,BASILICATA,PZ,SANT'ARCANGELO,associazioni sportive dilettantistiche,37,692.27,220.22,912.49
85005830014,FOOTBALL CLUB PEROSA A.S.D.,PIEMONTE,TO,PEROSA ARGENTINA,associazioni sportive dilettantistiche,31,727.94,184.51,912.45
95186810636,ATLETICA LEGGERA PORTICI,CAMPANIA,NA,PORTICI,associazioni sportive dilettantistiche,17,810.85,101.18,912.03
01603680347,POLISPORTIVA BASILICAGOIANO,EMILIA ROMAGNA,PR,MONTECHIARUGOLO,associazioni sportive dilettantistiche,26,757.27,154.75,912.02
96059080042,UNIONE SPORTIVA 2000 A.S.D. SAN ROCCO BERNEZZO,PIEMONTE,CN,BERNEZZO,associazioni sportive dilettantistiche,30,733.4,178.56,911.96
96008870014,ATLETICA SUSA,PIEMONTE,TO,SUSA,associazioni sportive dilettantistiche,24,768.99,142.85,911.84
82006050536,ASSOCIAZIONE SPORTIVA DILETTANTISTICA ARGENTARIO BASKET,TOSCANA,GR,MONTE ARGENTARIO,associazioni sportive dilettantistiche,36,697.53,214.27,911.8
91562590157,ASSOCIAZIONE SPORTIVA DILETTANTISTICA PUZZLE,LOMBARDIA,MI,CERNUSCO SUL NAVIGLIO,associazioni sportive dilettantistiche,19,798.07,113.09,911.16
92011880256,UNIONE SPORTIVA GHIACCIO PIEVE DI CADORE,VENETO,BL,PIEVE DI CADORE,associazioni sportive dilettantistiche,33,714.68,196.41,911.09
02682771205,ASSOCIAZIONE SPORTIVA DILETTANTISTICA TENNIS MEDICINA,EMILIA ROMAGNA,BO,MEDICINA,associazioni sportive dilettantistiche,26,755.82,154.75,910.57
92118470928,A.S.D. BETA,SARDEGNA,CA,CAGLIARI,associazioni sportive dilettantistiche,24,767.59,142.85,910.44
80011990522,ASSOCIAZIONE SPORTIVA DILETTANTISTICA GRUPPO SPORTIVO BUONCONVENTO,TOSCANA,SI,BUONCONVENTO,associazioni sportive dilettantistiche,32,719.24,190.46,909.7
80044170480,FIRENZE 2 BASKET,TOSCANA,FI,FIRENZE,associazioni sportive dilettantistiche,21,784.55,124.99,909.54
01386000192,FOOTBALLCLUB P.S.G. ASSOCIAZIONE SPORTIVA DILETTANTISTICA,LOMBARDIA,CR,SAN GIOVANNI IN CROCE,associazioni sportive dilettantistiche,25,760.43,148.8,909.23
92025670719,ATLETICA PADRE PIO,PUGLIA,FG,SAN GIOVANNI ROTONDO,associazioni sportive dilettantistiche,33,712.36,196.41,908.77
02377590340,A.S.D. VICO BASKET,EMILIA ROMAGNA,PR,PARMA,associazioni sportive dilettantistiche,18,800.99,107.13,908.12
03071160547,RUGBY PERUGIA JUNIOR ASD,UMBRIA,PG,PERUGIA,associazioni sportive dilettantistiche,25,759.14,148.8,907.94
00879760528,ASSOCIAZIONE SPORTIVA DILETTANTISTICA ATLETICA VALDELSA,TOSCANA,SI,COLLE DI VAL D'ELSA,associazioni sportive dilettantistiche,29,735.25,172.61,907.86
03683830164,U.S. CORNA IMAGNA ASSOCIAZIONE SPORTIVA DILETTANTISTICA,LOMBARDIA,BG,CORNA IMAGNA,associazioni sportive dilettantistiche,30,728.88,178.56,907.44
92012930258,ASSOCIAZIONE SPORTIVA DILETTANTISTICA DOMEGGE CALCIO,VENETO,BL,DOMEGGE DI CADORE,associazioni sportive dilettantistiche,32,716.61,190.46,907.07
96001560166,UNIONE SPORTIVA VIRTUS LOVERE ASSOCIAZIONE SPORTIVA DILETTANTISTICA,LOMBARDIA,BG,LOVERE,associazioni sportive dilettantistiche,36,691.9,214.27,906.17
02374950349,BASKET SAN SECONDO ASSOCIAZIONE SPORTIVA DILETTANTISTICA,EMILIA ROMAGNA,PR,SAN SECONDO PARMENSE,associazioni sportive dilettantistiche,27,745.13,160.7,905.83
81002680890,CLUB NAUTICO AUGUSTA ASSOCIAZIONE SPORTIVA DILETTANTISTICA,SICILIA,SR,AUGUSTA,associazioni sportive dilettantistiche,23,768.76,136.89,905.65
91006870298,ASSOCIAZIONE DILETTANTISTICA PALLACANESTRO BAGNOLO DI PO,VENETO,RO,BAGNOLO DI PO,associazioni sportive dilettantistiche,35,697.29,208.32,905.61
93034790043,VICOFORTE VOLLEY CEVA ASD,PIEMONTE,CN,VICOFORTE,associazioni sportive dilettantistiche,32,714.56,190.46,905.02
02275420186,POLISPORTIVA DILETTANTISTICA S. ALESSANDRO A.S.D.,LOMBARDIA,PV,PAVIA,associazioni sportive dilettantistiche,22,773.28,130.94,904.22
07082170965,F.C.D. REAL CRESCENZAGO,LOMBARDIA,MI,MILANO,associazioni sportive dilettantistiche,34,701.8,202.36,904.16
92001150512,ASD POLISPORTIVA ALBERGO OLIVETO,TOSCANA,AR,CIVITELLA IN VAL DI CHIANA,associazioni sportive dilettantistiche,50,606.53,297.6,904.13
01646810307,ASSOCIAZIONE SPORTIVA DILETTANTISTICA TOLMEZZO CARNIA,FRIULI VENEZIA GIULIA,UD,TOLMEZZO,associazioni sportive dilettantistiche,29,731.48,172.61,904.09
02458420284,ATLETICA GALLIERA VENETA,VENETO,PD,GALLIERA VENETA,associazioni sportive dilettantistiche,29,731.15,172.61,903.76
91005040083,DELTA RUGBY,LIGURIA,IM,IMPERIA,associazioni sportive dilettantistiche,26,748.69,154.75,903.44
91007290686,ASSOCIAZIONE SPORTIVA DILETTANTISTICA ATERNUM GINNASTICA,ABRUZZO,PE,PESCARA,associazioni sportive dilettantistiche,19,789.75,113.09,902.84
01225450939,ASSOCIAZIONE SPORTIVA DILETTANTISTICA SESTO BAGNAROLA,FRIULI VENEZIA GIULIA,PN,SESTO AL REGHENA,associazioni sportive dilettantistiche,18,795.63,107.13,902.76
90002730316,ASD ARIS SAN POLO,FRIULI VENEZIA GIULIA,GO,MONFALCONE,associazioni sportive dilettantistiche,27,741.87,160.7,902.57
90039610630,A.S.D. BLUE TEAM STABIAE,CAMPANIA,NA,GRAGNANO,associazioni sportive dilettantistiche,24,759.17,142.85,902.02
96007110172,ASSOCIAZIONE SPORTIVA DILETTANTISTICA ROBUR BARBARANO,LOMBARDIA,BS,SALO',associazioni sportive dilettantistiche,21,776.75,124.99,901.74
91056500555,TUTTINGIOCO LIBERTAS,UMBRIA,TR,TERNI,associazioni sportive dilettantistiche,36,687.36,214.27,901.63
02389230125,ASSOCIAZIONE DILETTANTISTICA GIOVANI ATLETI BASKET,LOMBARDIA,VA,SAMARATE,associazioni sportive dilettantistiche,29,726.85,172.61,899.46
83003390024,ASSOCIAZIONE SPORTIVA DILETTANTISTICA UNIONE SPORTIVA BIOGLIESE-VAL MOS,PIEMONTE,BI,BIOGLIO,associazioni sportive dilettantistiche,19,785.91,113.09,899.0
04163191002,NUOVA LEONINA P.,LAZIO,RM,ROMA,associazioni sportive dilettantistiche,14,815.53,83.33,898.86
90109010323,ASSOCIAZIONE SPORTIVA DILETTANTISTICA POLISPORTIVA TRIVENETO,FRIULI VENEZIA GIULIA,TS,TRIESTE,associazioni sportive dilettantistiche,15,809.08,89.28,898.36
02295830695,A.S.D.DREAM CHIETI C/5,ABRUZZO,CH,CHIETI,associazioni sportive dilettantistiche,42,648.17,249.98,898.15
91011960266,CONEGLIANO SUB,VENETO,TV,CONEGLIANO,associazioni sportive dilettantistiche,25,749.34,148.8,898.14
09483600152,A.C.D. FROG MILANO,LOMBARDIA,MI,MILANO,associazioni sportive dilettantistiche,23,761.13,136.89,898.02
85007090229,U.S. VALLAGARINA,TRENTO,TN,VILLA LAGARINA,associazioni sportive dilettantistiche,17,796.11,101.18,897.29
90001350769,ASSOCIAZIONE SPORTIVA CIRCOLO CANOTTIERI LUCANI,BASILICATA,PZ,SENISE,associazioni sportive dilettantistiche,43,641.29,255.93,897.22
06928860011,UNIONE SPORTIVA DILETTANTISTICA PRALORMO,PIEMONTE,TO,PRALORMO,associazioni sportive dilettantistiche,29,724.1,172.61,896.71
01824680209,ASSOCIAZIONE SPORTIVA DILETTANTISTICA PALLAVOLO QUISTELLO,LOMBARDIA,MN,QUISTELLO,associazioni sportive dilettantistiche,38,670.5,226.17,896.67
01609340904,A.S.D. QUADRIFOGLIO VOLLEY,SARDEGNA,SS,PORTO TORRES,associazioni sportive dilettantistiche,34,694.09,202.36,896.45
04645840481,Pallavolo I'Giglio,TOSCANA,FI,CASTELFIORENTINO,associazioni sportive dilettantistiche,26,741.58,154.75,896.33
01024500496,ASSOCIAZIONE SPORTIVA DILETTANTISTICA BASKET SAN VINCENZO,TOSCANA,LI,SAN VINCENZO,associazioni sportive dilettantistiche,27,735.51,160.7,896.21
91047040166,ASSOCIAZIONE SPORTIVA DILETTANTISTICA SANSONE ORATORIO,LOMBARDIA,BG,CISANO BERGAMASCO,associazioni sportive dilettantistiche,27,735.47,160.7,896.17
97347100584,ASSOCIAZIONE SPORTIVA FIANO ROMANO,LAZIO,RM,FIANO ROMANO,associazioni sportive dilettantistiche,21,770.41,124.99,895.4
02893760161,BASKET OSIO SOTTO ASSOCIAZIONE SPORTIVA DILETTANTISTICA,LOMBARDIA,BG,OSIO SOTTO,associazioni sportive dilettantistiche,29,722.6,172.61,895.21
01080620402,ASSOCIAZIONE SPORTIVA DILETTANTISTICA RONTA FOOTBALL CLUB,EMILIA ROMAGNA,FC,CESENA,associazioni sportive dilettantistiche,39,661.91,232.12,894.03
12002321003,GO SPORT ROMA ASD,LAZIO,RM,ROMA,associazioni sportive dilettantistiche,31,708.9,184.51,893.41
90001340547,CENTRO JUDO GINNASTICA TIFERNATE ASSOCIAZIONE SPORTIVA DILETTANTISTICA,UMBRIA,PG,CITTA' DI CASTELLO,associazioni sportive dilettantistiche,30,714.17,178.56,892.73
03937460289,A.S.D. PALLACANESTRO PIOVESE,VENETO,PD,PIOVE DI SACCO,associazioni sportive dilettantistiche,24,749.51,142.85,892.36
90191070730,ASD TRITONS BASEBALL SOFTBALL TEAM,PUGLIA,TA,TARANTO,associazioni sportive dilettantistiche,33,695.43,196.41,891.84
90001630145,GRUPPO PODISTICO VALCHIAVENNA ASSOCIAZIONE SPORTIVA DILETTANTISTICA,LOMBARDIA,SO,CHIAVENNA,associazioni sportive dilettantistiche,34,688.33,202.36,890.69
92012340029,ASSOCIAZIONE SPORTIVA DILETTANTISTICA TEENS BASKET COSSATOA.S.D. TEENS BASKET COSSATO,PIEMONTE,BI,COSSATO,associazioni sportive dilettantistiche,24,747.64,142.85,890.49
04172210264,ASSOCIAZIONE SPORTIVA DILETTANTISTICA CALCIO CAERANO,VENETO,TV,CAERANO DI SAN MARCO,associazioni sportive dilettantistiche,17,789.05,101.18,890.23
90003160166,UNIONE CICLISTICA SAN MARCO - A.S.D.,LOMBARDIA,BG,VERTOVA,associazioni sportive dilettantistiche,29,717.48,172.61,890.09
95023050107,ASSOCIAZIONE SPORTIVA DILETTANTISTICA EGOENERGY,LIGURIA,GE,GENOVA,associazioni sportive dilettantistiche,29,716.39,172.61,889.0
91002250420,CUPRA BASEBALL SOFTBALL SSD,MARCHE,AN,CUPRAMONTANA,associazioni sportive dilettantistiche,28,722.21,166.65,888.86
02470810546,ASSOCIAZIONE SPORTIVA ATHLON,UMBRIA,PG,BASTIA UMBRA,associazioni sportive dilettantistiche,27,728.11,160.7,888.81
02809720044,A.S.D. PALLONE ELASTICO SAN BIAGIO,PIEMONTE,CN,MONDOVI',associazioni sportive dilettantistiche,25,739.67,148.8,888.47
01128680863,ASSOCIAZIONE SPORTIVA DILETTANTISTICA 'GIUSEPPE PAGANA',SICILIA,EN,TROINA,associazioni sportive dilettantistiche,32,697.9,190.46,888.36
02785450830,ASC.SD L'INIZIATIVA,SICILIA,ME,SAN PIERO PATTI,associazioni sportive dilettantistiche,41,644.33,244.03,888.36
05557850483,BALONCESTO BASKET FIRENZE,TOSCANA,FI,FIRENZE,associazioni sportive dilettantistiche,28,721.24,166.65,887.89
83007830439,SOCIETA' SPORTIVA DILETTANTISTICA SETTEMPEDA,MARCHE,MC,SAN SEVERINO MARCHE,associazioni sportive dilettantistiche,15,798.34,89.28,887.62
01539840767,"U.C. DILETTANTISTICA RIONERO "" IL VELOCIFERO""",BASILICATA,PZ,RIONERO IN VULTURE,associazioni sportive dilettantistiche,34,685.23,202.36,887.59
04484600285,X SPORT ACADEMY ASSOCIAZIONE SPORTIVA DILETTANTIST,VENETO,PD,SELVAZZANO DENTRO,associazioni sportive dilettantistiche,23,750.51,136.89,887.4
94054500155,M.G.M. CALCIO A.S.D.,LOMBARDIA,MB,LESMO,associazioni sportive dilettantistiche,16,791.6,95.23,886.83
10506361004,HYDRA PALLANUOTO - ASSOCIAZIONE SPORTIVA DILETTANTISTICA,LAZIO,RM,ROMA,associazioni sportive dilettantistiche,12,814.29,71.42,885.71
92076920641,F.M. TEAM HORSES A.S.D.,CAMPANIA,SA,PONTECAGNANO FAIANO,associazioni sportive dilettantistiche,32,694.48,190.46,884.94
02170070029,POLISPORTIVA SAN LUIGI,LOMBARDIA,VA,ALBIZZATE,associazioni sportive dilettantistiche,23,747.93,136.89,884.82
93020760042,ASD VICESE '84,PIEMONTE,CN,VICOFORTE,associazioni sportive dilettantistiche,24,741.86,142.85,884.71
01661790269,PALLAVOLO VITTORIO VENETO ASSOCIAZIONE SPORTIVA DILETTANTISTICA,VENETO,TV,VITTORIO VENETO,associazioni sportive dilettantistiche,14,801.21,83.33,884.54
02161240359,A.S. DIL. TAEKWONDO TRICOLORE,EMILIA ROMAGNA,RE,REGGIO NELL'EMILIA,associazioni sportive dilettantistiche,27,723.52,160.7,884.22
92035170379,EDELWEISS 1957 ASD,EMILIA ROMAGNA,BO,BOLOGNA,associazioni sportive dilettantistiche,11,818.55,65.47,884.02
01447550623,GIOVENTU' BENEVENTO - ASSOCIAZIONE CULTURALE SPORTIVA DILETTANTISTICA,CAMPANIA,BN,BENEVENTO,associazioni sportive dilettantistiche,24,741.15,142.85,884.0
01559390768,U.S.D. PESCOPAGANO 1926,BASILICATA,PZ,PESCOPAGANO,associazioni sportive dilettantistiche,29,711.14,172.61,883.75
00950150532,SOC. SPORTIVA NUOTO GROSSETO,TOSCANA,GR,GROSSETO,associazioni sportive dilettantistiche,22,752.69,130.94,883.63
80003830892,CIRCOLO VELICO RIBELLINO ASSOCIAZIONE SPORTIVA DILETTANTISTICA,SICILIA,SR,SIRACUSA,associazioni sportive dilettantistiche,23,746.71,136.89,883.6
92208700283,LA CASA AZZURRA ASD,VENETO,PD,PADOVA,associazioni sportive dilettantistiche,19,770.25,113.09,883.34
97552490589,PALLAVOLO POMEZIA ASD,LAZIO,RM,POMEZIA,associazioni sportive dilettantistiche,21,757.59,124.99,882.58
00883300949,ASSOCIAZIONE SPORTIVA DILETTANTISTICA SAN LEUCIO ACQUAVIVA,MOLISE,IS,ISERNIA,associazioni sportive dilettantistiche,20,763.53,119.04,882.57
94020740042,ATLETICA SALUZZO ASSOCIAZIONE SPORTIVA DILETTANTISTICA (A.S.D.),PIEMONTE,CN,SALUZZO,associazioni sportive dilettantistiche,27,720.81,160.7,881.51
80016950216,AMATEURSPORTVEREIN STEINEGG,TRENTINO ALTO ADIGE,BZ,CORNEDO ALL'ISARCO .KARNEID.,associazioni sportive dilettantistiche,24,738.39,142.85,881.24
90025470502,ASSOCIAZIONE SPORTIVA DILETTANTISTICA PONTEDERA ATLETICA,TOSCANA,PI,PONTEDERA,associazioni sportive dilettantistiche,23,744.29,136.89,881.18
92001020210,AMATEURHOCKEYCLUB TOBLACH - DOBBIACO,TRENTINO ALTO ADIGE,BZ,DOBBIACO .TOBLACH.,associazioni sportive dilettantistiche,15,791.78,89.28,881.06
01214760553,ASSOCIAZIONE SPORTIVA DILETTANTISTICA LIBERTAS TACITO TERNI,UMBRIA,TR,TERNI,associazioni sportive dilettantistiche,22,749.96,130.94,880.9
94080170718,CENTRO STUDIO KARATE SHOTOKAN ASSOC. SPORTIVA DILETTANTISTICA,PUGLIA,FG,FOGGIA,associazioni sportive dilettantistiche,32,690.28,190.46,880.74
93048940717,ASSOCIAZIONE SPORTIVA DILETTANTISTICA MAGNIFICO BASKETBALL,PUGLIA,FG,SAN SEVERO,associazioni sportive dilettantistiche,19,767.2,113.09,880.29
02233420989,LA CONFRATERNITA DEL LEONE - ASSOCIAZIONE SPORTIVA DILETTANTISTICA,LOMBARDIA,BS,BRESCIA,associazioni sportive dilettantistiche,32,689.74,190.46,880.2
03703770234,FORTITUDO BASKET MOZZECANE A.S.D.,VENETO,VR,MOZZECANE,associazioni sportive dilettantistiche,32,688.77,190.46,879.23
02453840122,STELLA AZZURRA PALLAVOLO MALNATE ASSOCIAZIONE SPORTIVA DILETTANTISTICA,LOMBARDIA,VA,MALNATE,associazioni sportive dilettantistiche,21,753.65,124.99,878.64
03659630408,CENTRO GIOVANILE A.S.D. PROMOSPORT,EMILIA ROMAGNA,RN,RIMINI,associazioni sportive dilettantistiche,29,704.86,172.61,877.47
02312210269,ATLETICA SILCA CONEGLIANO ASSOCIAZIONE SPORTIVA DILETTANTISTICA,VENETO,TV,CONEGLIANO,associazioni sportive dilettantistiche,25,727.88,148.8,876.68
92503520014,CIRCOLO SUBACQUEI CANAVESANI ASSOCIAZIONE SPORTIVA DILETTANTISTICA,PIEMONTE,TO,IVREA,associazioni sportive dilettantistiche,16,781.2,95.23,876.43
02008331205,A.S.D. VILLANOVA S.LAZZARO PALLAVOLO,EMILIA ROMAGNA,BO,CASTENASO,associazioni sportive dilettantistiche,35,667.58,208.32,875.9
03934390489,UN.SPORTIVA DILETTANTISTICA GAMBASSI TERME,TOSCANA,FI,GAMBASSI TERME,associazioni sportive dilettantistiche,39,643.46,232.12,875.58
93528940153,A.S.GINNIKA 2001,LOMBARDIA,MI,RHO,associazioni sportive dilettantistiche,23,738.48,136.89,875.37
92042610409,ASSOCIAZIONE SPORTIVA DILETTANTISTICA 'EVER GREEN',EMILIA ROMAGNA,FC,MELDOLA,associazioni sportive dilettantistiche,27,714.34,160.7,875.04
91090730150,O.S.G.B. GIUSSANO ORATORIO S.G.BOSCO,LOMBARDIA,MB,GIUSSANO,associazioni sportive dilettantistiche,23,738.02,136.89,874.91
03448290282,C'E' L'ESTE RUGBY ASD,VENETO,PD,ESTE,associazioni sportive dilettantistiche,28,707.83,166.65,874.48
90001660498,ASSOCIAZIONE SPORTIVA PALLACANESTRO PIOMBINO,TOSCANA,LI,PIOMBINO,associazioni sportive dilettantistiche,17,771.42,101.18,872.6
01141560464,ATLETICA PIETRASANTA VERSILIA ASSOCIAZIONE SPORTIVA DILETTANTISTISCA,TOSCANA,LU,PIETRASANTA,associazioni sportive dilettantistiche,15,782.98,89.28,872.26
04531020651,ASSOCIAZIONE SPORTIVA DILETTANTISTICA POLISPORTIVA BASKET SALA CONSILINA,CAMPANIA,SA,SALA CONSILINA,associazioni sportive dilettantistiche,29,699.48,172.61,872.09
06254950824,ASSOCIAZIONE POLISPORTIVA DILETTANTISTICA CITTA' DI PETRALIA SOTTANA,SICILIA,PA,PETRALIA SOTTANA,associazioni sportive dilettantistiche,28,705.39,166.65,872.04
93425150724,PANTHERESS RUGBY GIRLS TEAM ASSOCIAZIONE SPORTIVA DILETTANT.,PUGLIA,BA,MODUGNO,associazioni sportive dilettantistiche,26,717.0,154.75,871.75
00996160677,A.S. ROSETO ASSOCIAZIONE SPORTIVA DILETTANTISTICA,ABRUZZO,TE,ROSETO DEGLI ABRUZZI,associazioni sportive dilettantistiche,34,669.13,202.36,871.49
01856120660,ASD JUJITSU ACADEMY,ABRUZZO,AQ,L'AQUILA,associazioni sportive dilettantistiche,25,722.48,148.8,871.28
90019690560,ATLETICA 90 TARQUINIA,LAZIO,VT,TARQUINIA,associazioni sportive dilettantistiche,23,734.14,136.89,871.03
81005460399,ASSOCIAZIONE RIOLESE SPORTIVA DILETTANTISITICA,EMILIA ROMAGNA,RA,RIOLO TERME,associazioni sportive dilettantistiche,25,721.82,148.8,870.62
91020660089,O.K. CLUB ASSOCIAZIONE SPORTIVA DILETTANTISTICA,LIGURIA,IM,IMPERIA,associazioni sportive dilettantistiche,27,708.7,160.7,869.4
