CODICE FISCALE,DENOMINAZIONE,REGIONE,PROVINCIA,COMUNE,categoria,NUMERO SCELTE,scelte espresse,scelte generiche,totale
80001830928,SOCIETA' GINNASTICA AMSICORA A.S.D.,SARDEGNA,CA,CAGLIARI,associazioni sportive dilettantistiche,42,1779.32,249.98,2029.3
03909470266,A.S.D. TARZO REVINE LAGO ASSOCIAZIONE SPORTIVA DILETTANTISTICA,VENETO,TV,REVINE LAGO,associazioni sportive dilettantistiche,50,1731.65,297.6,2029.25
91001800761,ASSOCIAZIONE SPORTIVA DILETTANTISTICA CICLO TEAM VALNOCE,BASILICATA,PZ,RIVELLO,associazioni sportive dilettantistiche,55,1700.65,327.35,2028.0
01419350937,ASS.SPORTIVA DILETTANTISTICA VOLLEY DEL SANVITESE,FRIULI VENEZIA GIULIA,PN,SAN VITO AL TAGLIAMENTO,associazioni sportive dilettantistiche,51,1721.77,303.55,2025.32
91030580160,U.S. ORIENS ASSOCIAZIONE SPORTIVA DILETTANTISTICA,LOMBARDIA,BG,BREMBATE,associazioni sportive dilettantistiche,46,1749.63,273.79,2023.42
00609700620,UNIONE SPORTIVA RUGBY BENEVENTO,CAMPANIA,BN,BENEVENTO,associazioni sportive dilettantistiche,56,1689.57,333.31,2022.88
03722830373,VIRTUS SCHERMA BOLOGNA ASSOC.SPORTIVA DILETTANTISTICA,EMILIA ROMAGNA,BO,BOLOGNA,associazioni sportive dilettantistiche,24,1879.73,142.85,2022.58
95185100161,ASSOCIAZIONE SPORTIVA DILETT.BERGAMO SWIM TEAM,LOMBARDIA,BG,BERGAMO,associazioni sportive dilettantistiche,36,1807.99,214.27,2022.26
97520230588,A.S.D. BAYERN MONTESACRO,LAZIO,RM,ROMA,associazioni sportive dilettantistiche,47,1742.03,279.74,2021.77
95116640103,VIRTUS GENOVA A.S.D.,LIGURIA,GE,GENOVA,associazioni sportive dilettantistiche,19,1908.12,113.09,2021.21
02490330350,A.S.D. PALLAMANO SECCHIA RUBIERA,EMILIA ROMAGNA,RE,RUBIERA,associazioni sportive dilettantistiche,42,1770.08,249.98,2020.06
83016810109,SOCIETA' CANOTTIERI ARGUS,LIGURIA,GE,SANTA MARGHERITA LIGURE,associazioni sportive dilettantistiche,72,1591.51,428.54,2020.05
90024800600,POLISPORTIVA INSIEME AUSONIA A.S.DILETTANTISTICA,LAZIO,FR,AUSONIA,associazioni sportive dilettantistiche,32,1829.08,190.46,2019.54
82003790258,ASSOCIAZIONE RUGBY FELTRE,VENETO,BL,FELTRE,associazioni sportive dilettantistiche,51,1714.67,303.55,2018.22
80010840306,ASSOCIAZIONE SPORTIVA DILETTANTISTICA MANZANESE,FRIULI VENEZIA GIULIA,UD,MANZANO,associazioni sportive dilettantistiche,44,1752.05,261.88,2013.93
01550300303,A.S.D. CIMENTI SCI CARNIA,FRIULI VENEZIA GIULIA,UD,TOLMEZZO,associazioni sportive dilettantistiche,30,1834.97,178.56,2013.53
91034020726,POLISPORTIVA GRAVINA AELECTI- SALVATORE GRAMEGNA,PUGLIA,BA,GRAVINA IN PUGLIA,associazioni sportive dilettantistiche,71,1589.59,422.58,2012.17
93001530836,A.S.D. STEFANESE CALCIO,SICILIA,ME,SANTO STEFANO DI CAMASTRA,associazioni sportive dilettantistiche,94,1449.67,559.48,2009.15
94005670263,POLISPORTIVA PREGANZIOL ASSOCIAZIONE SPORTIVA DILETTANTIS,VENETO,TV,PREGANZIOL,associazioni sportive dilettantistiche,52,1697.38,309.5,2006.88
92048200130,POLISPORTIVA SALA ASSOCIAZIONE SPORTIVA DILETTANTISTICA,LOMBARDIA,LC,CALOLZIOCORTE,associazioni sportive dilettantistiche,62,1636.81,369.02,2005.83
06222680966,A.S.D. AURORA OSGB,LOMBARDIA,MI,ABBIATEGRASSO,associazioni sportive dilettantistiche,45,1736.35,267.84,2004.19
03000590277,POLISPORTIVA DILETTANTISTICA ANNIA,VENETO,VE,QUARTO D'ALTINO,associazioni sportive dilettantistiche,32,1812.1,190.46,2002.56
90009670879,ASSOCIAZIONE SPORTIVA DILETTANTISTICA PALLAVOLO ZAFFERANA,SICILIA,CT,ZAFFERANA ETNEA,associazioni sportive dilettantistiche,60,1643.96,357.11,2001.07
08312370961,A.S.D. SPERANZA AGRATE,LOMBARDIA,MB,AGRATE BRIANZA,associazioni sportive dilettantistiche,58,1651.39,345.21,1996.6
95098070162,S.S. EXCELSIOR SEZIONE CALCIO,LOMBARDIA,BG,BERGAMO,associazioni sportive dilettantistiche,24,1851.54,142.85,1994.39
91028800745,"ASSOC.SPORTIVA DILETTANTISTICA"" METROPOLITAN KARATE SHOTOKAN """,PUGLIA,BR,BRINDISI,associazioni sportive dilettantistiche,64,1610.93,380.92,1991.85
94015510152,POLISPORTIVA CARUGATE ASD,LOMBARDIA,MI,CARUGATE,associazioni sportive dilettantistiche,58,1646.12,345.21,1991.33
02688070214,ASSOCIAZIONE SPORTIVA DILETTANTISTICA SPORT TEAM SUDTIROL,TRENTINO ALTO ADIGE,BZ,BOLZANO .BOZEN.,associazioni sportive dilettantistiche,51,1687.51,303.55,1991.06
92034420379,P.G.S. CORTICELLA,EMILIA ROMAGNA,BO,BOLOGNA,associazioni sportive dilettantistiche,57,1651.77,339.26,1991.03
02208790135,C.D.G. VENIANO,LOMBARDIA,CO,VENIANO,associazioni sportive dilettantistiche,57,1651.74,339.26,1991.0
90034050048,PESCA PROMOTION - ASSOCIAZIONE SPORTIVA DILETTANTISTICA,PIEMONTE,CN,SANTO STEFANO BELBO,associazioni sportive dilettantistiche,35,1782.54,208.32,1990.86
02547310124,ASSOCIAZIONE SPORTIVA DILETTANTISTICA NUOVA ATLETICA VARESE,LOMBARDIA,VA,VARESE,associazioni sportive dilettantistiche,44,1727.23,261.88,1989.11
97037220825,ASSOCIAZIONE SPORTIVA CULTURALE PROSPETTIVE NUOVE,SICILIA,PA,PALERMO,associazioni sportive dilettantistiche,104,1368.86,619.0,1987.86
02171590033,A.S.D. SCUOLA BASKET TICINO,PIEMONTE,NO,OLEGGIO,associazioni sportive dilettantistiche,68,1582.48,404.73,1987.21
10719390154,ASSOCIAZIONE SPORTIVA DILETTANTISTICA NUOTATORI MILANESI (A.S.D. NUOTATORI MILANESI),LOMBARDIA,MI,MILANO,associazioni sportive dilettantistiche,42,1735.65,249.98,1985.63
90017840928,S.S.D. CALASETTA BASKET,SARDEGNA,CI,CALASETTA,associazioni sportive dilettantistiche,61,1620.78,363.07,1983.85
91010840691,REAL GUARDIAGRELE C5,ABRUZZO,CH,ORSOGNA,associazioni sportive dilettantistiche,77,1524.57,458.3,1982.87
00836160119,GOLF CLUB MARIGOLA LERICI,LIGURIA,SP,LERICI,associazioni sportive dilettantistiche,23,1845.8,136.89,1982.69
00509720314,ASSOCIAZIONE DILETTANTISTICA PALLACANESTRO GRADO,FRIULI VENEZIA GIULIA,GO,GRADO,associazioni sportive dilettantistiche,55,1654.7,327.35,1982.05
90002500404,ELEPHAS CESENA BASEBALL A.S.D.,EMILIA ROMAGNA,FC,CESENA,associazioni sportive dilettantistiche,48,1695.46,285.69,1981.15
93003570277,ASS.NE SPORTIVA DILETTANTISTICA ATLETICA JESOLO,VENETO,VE,JESOLO,associazioni sportive dilettantistiche,42,1728.49,249.98,1978.47
92009670198,"POLISPORTIVA ORATORIO CASTELLEONE ""DON EUGENIO MONDINI""",LOMBARDIA,CR,CASTELLEONE,associazioni sportive dilettantistiche,29,1804.85,172.61,1977.46
02177960065,BOYS OVADA A.S.D.,PIEMONTE,AL,OVADA,associazioni sportive dilettantistiche,54,1655.39,321.4,1976.79
97089100834,ASS.SPORTIVA DILETTANTISTICA INTERNET POINT DI DE SALVO,SICILIA,ME,MESSINA,associazioni sportive dilettantistiche,57,1635.22,339.26,1974.48
01849960693,ASSOCIAZIONE SPORTIVA DILETTANTISTICA VILLAGE BASKET,ABRUZZO,CH,CHIETI,associazioni sportive dilettantistiche,55,1646.65,327.35,1974.0
08109580152,A.S.D. ALCIONE ASSOCIAZIONE SPORTIVA DILETTANTISTICA,LOMBARDIA,MI,MILANO,associazioni sportive dilettantistiche,35,1762.75,208.32,1971.07
80079250371,ASSOCIAZIONE SPORTIVA RARI NANTES - BOLOGNA,EMILIA ROMAGNA,BO,BOLOGNA,associazioni sportive dilettantistiche,36,1754.55,214.27,1968.82
80014060216,AMATEURSPORTVEREIN VOELS AM SCHLERN,TRENTINO ALTO ADIGE,BZ,FIE' ALLO SCILIAR .VOELS AM SCHLERN.,associazioni sportive dilettantistiche,32,1778.33,190.46,1968.79
01829160033,ASSOCIAZIONE SPORTIVA DILETTANTISTICA CENTRO GIOVANILE CERANO,PIEMONTE,NO,CERANO,associazioni sportive dilettantistiche,58,1623.03,345.21,1968.24
95006170120,ASSOCIAZIONE SPORTIVA DILETTANTISTICA TENNIS TAVOLO VARESE,LOMBARDIA,VA,BODIO LOMNAGO,associazioni sportive dilettantistiche,40,1725.11,238.08,1963.19
01939710362,CIRCOLO TENNIS CARPI,EMILIA ROMAGNA,MO,CARPI,associazioni sportive dilettantistiche,55,1635.44,327.35,1962.79
02520950276,ASSOCIAZIONE SPORTIVA DILETTANTISTICA ATLETICA BIOTEKNA MARCON,VENETO,VE,MARCON,associazioni sportive dilettantistiche,10,1903.05,59.52,1962.57
80024690242,UNIONE SPORTIVA ALTAIR A.S.D.,VENETO,VI,VICENZA,associazioni sportive dilettantistiche,56,1628.5,333.31,1961.81
94068210031,POLISPORTIVA SOCIALE CHINA E PINO MAFFEO ASD/APS,PIEMONTE,NO,CERANO,associazioni sportive dilettantistiche,38,1734.58,226.17,1960.75
92044850151,A.S.D. BULLS RESCALDINA,LOMBARDIA,MI,RESCALDINA,associazioni sportive dilettantistiche,57,1618.31,339.26,1957.57
02286880469,A.S.D. SECCO NATIONAL,TOSCANA,LU,CAMAIORE,associazioni sportive dilettantistiche,70,1540.64,416.63,1957.27
90002730712,ASSOCIAZIONE DILETTANTISTICA SPORTING CLUB,PUGLIA,FG,CERIGNOLA,associazioni sportive dilettantistiche,70,1538.08,416.63,1954.71
91010400819,ASSOCIAZIONE DILETTANTISTICA SCACCHI LILYBETANA,SICILIA,TP,MARSALA,associazioni sportive dilettantistiche,36,1739.95,214.27,1954.22
02641610163,VOLLEY EXCELSIOR BERGAMO ASSOCIAZIONE SPORTIVA DILETTANTISTICA,LOMBARDIA,BG,BERGAMO,associazioni sportive dilettantistiche,7,1911.84,41.66,1953.5
08273780018,ASSOCIAZIONE SPORTIVA DILETTANTISTICA HOCKEY CLUB PINEROLO,PIEMONTE,TO,PINEROLO,associazioni sportive dilettantistiche,46,1678.71,273.79,1952.5
94020110485,SCI CLUB LANCIOTTO - ASSOCIAZIONE SPORTIVA DILETTANTISTICA,TOSCANA,FI,CAMPI BISENZIO,associazioni sportive dilettantistiche,17,1850.93,101.18,1952.11
00604060228,UNIONE SPORTIVA SAN GIORGIO ASSOCIAZIONE DILETTANTISTICA PALLAVOLO - ORIENTEERING,TRENTO,TN,TRENTO,associazioni sportive dilettantistiche,51,1647.36,303.55,1950.91
90013280657,ASSOCIAZIONE SPORTIVA DILETTANTISTICA OLIMPIA AGROPOLI,CAMPANIA,SA,AGROPOLI,associazioni sportive dilettantistiche,65,1563.34,386.87,1950.21
92000560034,ASSOCIAZIONE SPORTIVA DILETTANTISTICA CADDESE,PIEMONTE,VB,CREVOLADOSSOLA,associazioni sportive dilettantistiche,64,1568.34,380.92,1949.26
01351510308,ASSOCIAZIONE DILETTANTISTICA PALLACANESTRO CODROIPESE,FRIULI VENEZIA GIULIA,UD,CODROIPO,associazioni sportive dilettantistiche,45,1681.05,267.84,1948.89
02910920616,ASSOCIAZ. SPORT. DILETTANTISTICA HWA RANG KWAN,CAMPANIA,CE,CASERTA,associazioni sportive dilettantistiche,58,1601.78,345.21,1946.99
00258370329,ASSOCIAZIONE SPORTIVA DILETTANTISTICA DOMIO,FRIULI VENEZIA GIULIA,TS,SAN DORLIGO DELLA VALLE,associazioni sportive dilettantistiche,59,1595.36,351.16,1946.52
01226910220,ASSOCIAZIONE SPORTIVA DILETTANTISTICA CASTELSANGIORGIO,TRENTO,TN,ALA,associazioni sportive dilettantistiche,77,1488.1,458.3,1946.4
10958771007,NATIONAL IV MIGLIO A.C.S.D.,LAZIO,RM,ROMA,associazioni sportive dilettantistiche,29,1773.73,172.61,1946.34
92180820281,ASSOCIAZIONE JIN A.S.D.,VENETO,PD,PADOVA,associazioni sportive dilettantistiche,32,1755.4,190.46,1945.86
01771640131,ASSOCIAZIONE DILETTANTISTICA POLISPORTIVA OLGINATE,LOMBARDIA,LC,OLGINATE,associazioni sportive dilettantistiche,59,1594.59,351.16,1945.75
01589930427,ASSOCIAZIONE SPORTIVA DILETTANTISTICA VELA NUOTO ANCONA,MARCHE,AN,ANCONA,associazioni sportive dilettantistiche,49,1653.75,291.64,1945.39
03374390262,ASSOCIAZIONE SPORTIVA DILETTANTISTICA VITTSANGIACOMO,VENETO,TV,VITTORIO VENETO,associazioni sportive dilettantistiche,71,1522.77,422.58,1945.35
02040610160,ASSOCIAZIONE SPORTIVA DILETTANTISTICA CENTRO PALLAVOLO 27,LOMBARDIA,BG,SAN GIOVANNI BIANCO,associazioni sportive dilettantistiche,56,1611.18,333.31,1944.49
03427750165,POLISPORTIVA SCHERMA BG ASSOCIAZIONE SPORTIVA DILETTANTISTICA,LOMBARDIA,BG,BERGAMO,associazioni sportive dilettantistiche,53,1626.72,315.45,1942.17
94056200655,ASSOCIAZIONE SPORTIVA DILETTANTISTICA TENNIS TAVOLO ALDO PAPPALARDO,CAMPANIA,SA,ANGRI,associazioni sportive dilettantistiche,89,1408.24,529.72,1937.96
12513870159,ASSOCIAZIONE SPORTIVA DILETTANTISTICA VISMARA,LOMBARDIA,MI,MILANO,associazioni sportive dilettantistiche,23,1800.78,136.89,1937.67
01807610223,ATLETICA VALLE DI CEMBRA,TRENTO,TN,CEMBRA,associazioni sportive dilettantistiche,72,1508.54,428.54,1937.08
93035400154,A.S.D. NEW ARTEPHION,LOMBARDIA,MI,INVERUNO,associazioni sportive dilettantistiche,57,1597.77,339.26,1937.03
03118460041,VOLLEY BALLCLUB SAVIGLIANO ASSOCIAZIONE DILETTANTISTICA,PIEMONTE,CN,SAVIGLIANO,associazioni sportive dilettantistiche,48,1651.0,285.69,1936.69
97403400159,SPES SAN PROTASO ESAGONO SPORT,LOMBARDIA,MI,MILANO,associazioni sportive dilettantistiche,30,1757.55,178.56,1936.11
93021400721,POLISPORTIVA NIKE ASSOCIAZIONE SPORTIVA DILETTANTISTICA,PUGLIA,BA,TERLIZZI,associazioni sportive dilettantistiche,52,1624.98,309.5,1934.48
02901040838,ASSOCIAZIONE SPORTIVA DILETTANTISTICA FOCUS PLANET DANCE,SICILIA,ME,LIBRIZZI,associazioni sportive dilettantistiche,65,1547.49,386.87,1934.36
01255610931,ASSOCIAZIONE POLISPORTIVA DILETTANTISTICA LIBERTAS PORCIA,FRIULI VENEZIA GIULIA,PN,PORCIA,associazioni sportive dilettantistiche,72,1505.71,428.54,1934.25
85009540015,VELOCE CLUB ASSOCIAZIONE SPORTIVA DILETTANTISTICA,PIEMONTE,TO,PINEROLO,associazioni sportive dilettantistiche,44,1671.43,261.88,1933.31
03138131200,A.S.D. CASTIGLIONE CALCIO,EMILIA ROMAGNA,BO,CASTIGLIONE DEI PEPOLI,associazioni sportive dilettantistiche,37,1712.77,220.22,1932.99
02536410406,A.S.D. RIMINI UNITED MALATESTA,EMILIA ROMAGNA,RN,RIMINI,associazioni sportive dilettantistiche,56,1599.31,333.31,1932.62
02440570303,AURORA VOLLEY UDINE ASS.POL.DIL,FRIULI VENEZIA GIULIA,UD,UDINE,associazioni sportive dilettantistiche,65,1545.55,386.87,1932.42
02497290300,GRUPPO SPORTIVO NATISONE - ASS. SPORTIVA DILETTANTISTICA,FRIULI VENEZIA GIULIA,UD,CIVIDALE DEL FRIULI,associazioni sportive dilettantistiche,44,1668.58,261.88,1930.46
02134870019,ASSOCIAZIONE SPORTIVA DILETTANTISTICA CALCIO CHIERI,PIEMONTE,TO,CHIERI,associazioni sportive dilettantistiche,32,1739.99,190.46,1930.45
02055280693,ASSOCIAZIONE SPORTIVA MAGIC BASKET CHIETI,ABRUZZO,CH,CHIETI,associazioni sportive dilettantistiche,35,1721.94,208.32,1930.26
03091480248,ASSOCIAZIONE SPORTIVA DILETTANTISTICA - VOLLEY SANDRIGO,VENETO,VI,SANDRIGO,associazioni sportive dilettantistiche,39,1698.12,232.12,1930.24
02145540445,POLISPORTIVA SPAZIO STELLE ASSOCIAZ.SPORTIVA DILETTANTISTICA,MARCHE,AP,MONSAMPOLO DEL TRONTO,associazioni sportive dilettantistiche,93,1374.8,553.53,1928.33
03751270871,A.S.D. MASCALUCIA C5,SICILIA,CT,MASCALUCIA,associazioni sportive dilettantistiche,43,1671.99,255.93,1927.92
01406720092,TENNIS CLUB CERIALE ASSOCIAZIONE SPORTIVA DILETTANTISTICA,LIGURIA,SV,CERIALE,associazioni sportive dilettantistiche,66,1533.82,392.83,1926.65
04318340876,POLISPORTIVA VOLLEY ACIREALE,SICILIA,CT,ACIREALE,associazioni sportive dilettantistiche,65,1539.6,386.87,1926.47
06448500725,A.S.D.SANNICANDRO,PUGLIA,BA,SANNICANDRO DI BARI,associazioni sportive dilettantistiche,69,1514.2,410.68,1924.88
00703010140,ASSOC.SPORT. DILETT.ALBOSAGGIA PONCHIERA,LOMBARDIA,SO,SONDRIO,associazioni sportive dilettantistiche,67,1525.76,398.78,1924.54
97510250018,UNIONE SPORTIVA LABOR ASD,PIEMONTE,TO,TORINO,associazioni sportive dilettantistiche,51,1620.96,303.55,1924.51
03911660011,POLISPORTIVA DRAVELLI A.S.D.,PIEMONTE,TO,MONCALIERI,associazioni sportive dilettantistiche,50,1626.3,297.6,1923.9
93047890194,ZENITH - ASSOCIAZIONE SPORTIVA DILETTANTISTICA,LOMBARDIA,CR,CREMONA,associazioni sportive dilettantistiche,49,1632.18,291.64,1923.82
80027630872,C.S.I. POLISPORTIVA S. PAOLO ASSOCIAZIONE SPORTIVA DILETTANTISTICA,SICILIA,CT,GRAVINA DI CATANIA,associazioni sportive dilettantistiche,67,1524.61,398.78,1923.39
01817870973,A.S.DIL. PALLACANESTRO 2000 PRATO,TOSCANA,PO,PRATO,associazioni sportive dilettantistiche,21,1795.72,124.99,1920.71
01851510386,A.S.D. POLISPORTIVA SANT'AGOSTINO 2011,EMILIA ROMAGNA,FE,SANT'AGOSTINO,associazioni sportive dilettantistiche,54,1598.45,321.4,1919.85
94053520212,SSV BOZEN - AMATEURSPORTVEREIN,TRENTINO ALTO ADIGE,BZ,BOLZANO .BOZEN.,associazioni sportive dilettantistiche,34,1716.99,202.36,1919.35
02354960961,IRIDE COLOGNO RUGBY ASSOCIAZIONE DILETTANTISTICA,LOMBARDIA,MI,COLOGNO MONZESE,associazioni sportive dilettantistiche,39,1685.95,232.12,1918.07
00743060329,ASD LIBERTAS TRIESTE,FRIULI VENEZIA GIULIA,TS,TRIESTE,associazioni sportive dilettantistiche,50,1619.79,297.6,1917.39
02292481203,ASSOCIAZIONE CALCIO DILETTANTISTICA BASCA 2002,EMILIA ROMAGNA,BO,SAN GIORGIO DI PIANO,associazioni sportive dilettantistiche,57,1577.67,339.26,1916.93
02284520596,GSI-GRUPPO SPORTIVO ITALIANO DILETTANTISTICA,LAZIO,LT,LATINA,associazioni sportive dilettantistiche,54,1594.21,321.4,1915.61
91009830638,SCUOLA VOLLEY FORIO - ASSOCIAZIONE SPORTIVA E RICREATIVA DILETTANTISTICA,CAMPANIA,NA,FORIO,associazioni sportive dilettantistiche,82,1424.27,488.06,1912.33
07186320151,A.S.D. CARNATE - USMATE VELATE VOLLEY,LOMBARDIA,MB,CARNATE,associazioni sportive dilettantistiche,35,1700.32,208.32,1908.64
03116400262,A.S.D. BASEBALL CLUB CONEGLIANO,VENETO,TV,CONEGLIANO,associazioni sportive dilettantistiche,61,1543.94,363.07,1907.01
94003760272,ASSOCIAZIONE CANOTTIERI GIUDECCA,VENETO,VE,VENEZIA,associazioni sportive dilettantistiche,42,1656.79,249.98,1906.77
04057950968,A.S.D. SENZA SCOPO DI LUCRO BUTOKU-KARATE DO,LOMBARDIA,MI,SOLARO,associazioni sportive dilettantistiche,54,1584.79,321.4,1906.19
97009090784,ASD POLISPORTIVA MURIALDINA,CALABRIA,CS,ROSSANO,associazioni sportive dilettantistiche,66,1512.81,392.83,1905.64
02203470402,ASSOCIAZIONE CALCISTICA DIL. MODIGLIANA CALCIO,EMILIA ROMAGNA,FC,MODIGLIANA,associazioni sportive dilettantistiche,79,1433.23,470.2,1903.43
03481670408,CARA BABY ROCK 'N' ROLL,EMILIA ROMAGNA,FC,CESENA,associazioni sportive dilettantistiche,64,1521.1,380.92,1902.02
90031520126,ASSOCIAZIONE SPORTIVA DILETTANTISTICA GRUPPO SPORTIVO S. STANISLAO,LOMBARDIA,VA,FAGNANO OLONA,associazioni sportive dilettantistiche,50,1603.81,297.6,1901.41
81001970912,U.S. TONARA A.S.D.,SARDEGNA,NU,TONARA,associazioni sportive dilettantistiche,60,1542.78,357.11,1899.89
92152840283,ASSOCIAZIONE SPORTIVA DILETTANTISTICA BLUKIPPE,VENETO,PD,PADOVA,associazioni sportive dilettantistiche,44,1637.43,261.88,1899.31
00851970327,ASS.SPORTIVA DILETTANTISTICA MONTEBELLO DON BOSCO TRIESTE,FRIULI VENEZIA GIULIA,TS,TRIESTE,associazioni sportive dilettantistiche,69,1488.48,410.68,1899.16
00873250245,ASSOCIAZIONE SPORTIVA DILETTANTISTICA HOCKEY THIENE,VENETO,VI,THIENE,associazioni sportive dilettantistiche,30,1720.03,178.56,1898.59
02919320230,A.S.D.CRAZY SAMBONIFACESE B.S.,VENETO,VR,SAN BONIFACIO,associazioni sportive dilettantistiche,36,1682.75,214.27,1897.02
80092340019,SOCIETA' CANOTTIERI CAPRERA - ASSOCIAZIONE SPORTIVA DILETTANTISTICA,PIEMONTE,TO,TORINO,associazioni sportive dilettantistiche,25,1747.91,148.8,1896.71
92178180284,CORPO LIBERO GYMNASTIC TEAM ASS.NE SPORTIVADILETTANTISTICA,VENETO,PD,PADOVA,associazioni sportive dilettantistiche,65,1508.69,386.87,1895.56
91032380791,ACHEI CROTONE ASSOCIAZIONE SPORTIVA DILETTANTISTICA,CALABRIA,KR,CROTONE,associazioni sportive dilettantistiche,42,1645.39,249.98,1895.37
02006460121,A.S.D.BASKET VALCERESIO,LOMBARDIA,VA,ARCISATE,associazioni sportive dilettantistiche,38,1669.15,226.17,1895.32
90018880956,AZZURRA BASKET ASSOCIAZIONE SPORTIVA DILETTAN,SARDEGNA,OR,ORISTANO,associazioni sportive dilettantistiche,46,1621.21,273.79,1895.0
01199640069,CIRCOLO PIER GIORGIO FRASSATI,PIEMONTE,AL,CASALE MONFERRATO,associazioni sportive dilettantistiche,68,1488.35,404.73,1893.08
93064370666,"""ASSOCIAZIONE CULTURALE E SPORTIVA RESPIRA IL GRAN SASSO L'AQUILA""",ABRUZZO,AQ,L'AQUILA,associazioni sportive dilettantistiche,55,1565.1,327.35,1892.45
91000460930,A.S.D. GINNASTICA SANVITESE,FRIULI VENEZIA GIULIA,PN,SAN VITO AL TAGLIAMENTO,associazioni sportive dilettantistiche,35,1680.76,208.32,1889.08
10643251001,ASD CRETAROSSA NETTUNO,LAZIO,RM,NETTUNO,associazioni sportive dilettantistiche,73,1454.56,434.49,1889.05
92069150495,LIONS AMARANTO SOC. SPORTIVA,TOSCANA,LI,LIVORNO,associazioni sportive dilettantistiche,46,1615.08,273.79,1888.87
80101990010,UNIONE SPORTIVA BARRACUDA - DI VIESTO,PIEMONTE,TO,TORINO,associazioni sportive dilettantistiche,75,1442.47,446.39,1888.86
02145790925,VBA OLIMPIA S.ANTIOCO ASSOCIAZIONE SPORTIVA DILETTANTISTICA,SARDEGNA,CI,SANT'ANTIOCO,associazioni sportive dilettantistiche,36,1673.5,214.27,1887.77
92044150859,A.S.D. ATLETICO CAMPOFRANCO,SICILIA,CL,CAMPOFRANCO,associazioni sportive dilettantistiche,65,1498.71,386.87,1885.58
02468130964,G.S. DILETTANTISTICO SERENISSIMA S. PIO X,LOMBARDIA,MI,CINISELLO BALSAMO,associazioni sportive dilettantistiche,59,1533.45,351.16,1884.61
80028490268,ATLETICA STIORE TREVISO,VENETO,TV,TREVISO,associazioni sportive dilettantistiche,42,1634.52,249.98,1884.5
90000790361,ASSOCIAZIONE SPORTIVA DILETTANTISTICA POLISPORTIVA SOLIERESE - SETTORE CALCIO,EMILIA ROMAGNA,MO,SOLIERA,associazioni sportive dilettantistiche,39,1652.18,232.12,1884.3
01583310667,ASSOCIAZ. SPORTIVA DILETTANTISTICA CALCIO A CINQUE A.I.D. SAN GIUSEPPE,ABRUZZO,AQ,BUGNARA,associazioni sportive dilettantistiche,85,1375.97,505.91,1881.88
01706450226,ASSOCIAZIONE DILETTANTISTICA VOLLEY VALLE DEI LAGHI,TRENTO,TN,CAVEDINE,associazioni sportive dilettantistiche,55,1551.84,327.35,1879.19
04908270483,A.C. GIOVANI FUCECCHIO 2000,TOSCANA,FI,FUCECCHIO,associazioni sportive dilettantistiche,41,1635.02,244.03,1879.05
00609460076,SOCIETA' GINNASTICA RITMICA AUGUSTA PRAETORIA A.S.D.,VALLE D'AOSTA,AO,AOSTA,associazioni sportive dilettantistiche,63,1502.64,374.97,1877.61
91010480902,POLISPORTIVA CIVITAS ASSOCIAZIONE SPORTIVA DILETTANTI,SARDEGNA,OT,TEMPIO PAUSANIA,associazioni sportive dilettantistiche,50,1579.0,297.6,1876.6
93052620635,CENTO CUORI,CAMPANIA,NA,CASALNUOVO DI NAPOLI,associazioni sportive dilettantistiche,60,1519.05,357.11,1876.16
97699790016,ASSOCIAZIONE SPORTIVA DILETTANTISTICA POLISPORTIVA SAN DONATO,PIEMONTE,TO,TORINO,associazioni sportive dilettantistiche,42,1625.96,249.98,1875.94
07681220963,ASD ATLETICO BUSSERO - ASSOCIAZIONE SPORTIVA DILETTANTISTICA,LOMBARDIA,MI,BUSSERO,associazioni sportive dilettantistiche,29,1701.09,172.61,1873.7
94089600301,"GRUPPO SPORTIVO DILETTANTISTICO""FUTSAL UDINE""",FRIULI VENEZIA GIULIA,UD,UDINE,associazioni sportive dilettantistiche,23,1736.07,136.89,1872.96
04421500820,A.S.D. CITTA' ISOLA DELLE FEMMINE,SICILIA,PA,ISOLA DELLE FEMMINE,associazioni sportive dilettantistiche,80,1395.37,476.15,1871.52
00622460228,U.S. MONTI PALLIDI MOENA,TRENTO,TN,MOENA,associazioni sportive dilettantistiche,55,1543.73,327.35,1871.08
91008400144,ASSOCIAZIONE SPORTIVA DILETTANTISTICA A.C. OLYMPIC RETICA,LOMBARDIA,SO,DAZIO,associazioni sportive dilettantistiche,74,1429.18,440.44,1869.62
12291060155,A.S. POZZUOLO CALCIO,LOMBARDIA,MI,POZZUOLO MARTESANA,associazioni sportive dilettantistiche,18,1762.08,107.13,1869.21
80096760014,CLUB SCHERMA TORINO,PIEMONTE,TO,TORINO,associazioni sportive dilettantistiche,16,1773.43,95.23,1868.66
00761570217,ASS. SPORTIVA MERANO - SEZ. SCI ALPINO,TRENTINO ALTO ADIGE,BZ,MERANO .MERAN.,associazioni sportive dilettantistiche,30,1687.53,178.56,1866.09
80003400316,""" CIRCOLO TENNIS GORIZIA - ALDO ZACCARELLI - ASSOCIAZIONE SPORTIVA DILET TANTISTICA """,FRIULI VENEZIA GIULIA,GO,GORIZIA,associazioni sportive dilettantistiche,26,1711.0,154.75,1865.75
03428360378,PALLAVOLO BUDRIO ASSOCIAZIONE SPORTIVA DILETTANTISTICA,EMILIA ROMAGNA,BO,BUDRIO,associazioni sportive dilettantistiche,51,1561.2,303.55,1864.75
95023380181,GRUPPO SPORTIVO DILETTANTISTICO GIOVANILE LUNGAVILLA,LOMBARDIA,PV,LUNGAVILLA,associazioni sportive dilettantistiche,44,1602.36,261.88,1864.24
91033380261,ATLETICA S. LUCIA DI PIAVE ASSOCIAZIONE SPORTIVA DILETTANTISTICA,VENETO,TV,SANTA LUCIA DI PIAVE,associazioni sportive dilettantistiche,51,1557.81,303.55,1861.36
02036420392,RINASCITA NUOTO TEAM ROMAGNA ASSOCIAZIONE SPORTIVA DILETTANTISTICA,EMILIA ROMAGNA,RA,RAVENNA,associazioni sportive dilettantistiche,38,1634.63,226.17,1860.8
02331600136,ASSOCIAZIONE SPORTIVA DILETTANTISTICA UNIONE SPORTIVA LARIO,LOMBARDIA,CO,COMO,associazioni sportive dilettantistiche,55,1532.84,327.35,1860.19
97512970019,ASSOCIAZIONE SPORTIVA DILETTANTISTICA POLISPORTIVA MIRAFIORI,PIEMONTE,TO,TORINO,associazioni sportive dilettantistiche,58,1514.36,345.21,1859.57
91117160159,CENTRO DI EDUCAZIONE MOTORIA A.S.D.,LOMBARDIA,MB,CESANO MADERNO,associazioni sportive dilettantistiche,69,1447.34,410.68,1858.02
01679830131,UNIONE SPORTIVA DERVIESE ASSOCIAZIONE SPORTIVA DILETTANTISTICA,LOMBARDIA,LC,DERVIO,associazioni sportive dilettantistiche,56,1524.54,333.31,1857.85
94099990213,BOLZANO EQUESTRIAN CENTRE A.S.D.,TRENTINO ALTO ADIGE,BZ,BOLZANO .BOZEN.,associazioni sportive dilettantistiche,19,1742.25,113.09,1855.34
91042860121,ASSOCIAZIONE SPORTIVA DILETTANTISTICA O.S.G.B. MADONNA IN CAMPAGNA,LOMBARDIA,VA,GALLARATE,associazioni sportive dilettantistiche,53,1539.25,315.45,1854.7
06327181001,A.S.D. ATLETICA COLOSSEO 2000,LAZIO,RM,ROMA,associazioni sportive dilettantistiche,34,1650.66,202.36,1853.02
04612060261,ASSOCIAZIONE SPORTIVA DILETTANTISTICA UNIONGAIA F.G.,VENETO,TV,GAIARINE,associazioni sportive dilettantistiche,69,1440.23,410.68,1850.91
03215960232,ASD SAN MARTINO BASKET,VENETO,VR,SAN MARTINO BUON ALBERGO,associazioni sportive dilettantistiche,45,1577.1,267.84,1844.94
92076740908,ASSOCIAZIONE SPORTIVA DILETTANTISTICA CATALUNYA ALGHERO,SARDEGNA,SS,ALGHERO,associazioni sportive dilettantistiche,73,1410.19,434.49,1844.68
03165420278,ASSOCIAZIONE SPORTIVA DILETTANTISTICA PALLAVOLO STRA,VENETO,VE,STRA,associazioni sportive dilettantistiche,53,1529.16,315.45,1844.61
92000230885,A.S.D. BASKET CLUB RAGUSA,SICILIA,RG,RAGUSA,associazioni sportive dilettantistiche,35,1635.74,208.32,1844.06
03722370370,CASTENASO VOLLEY A.S.DILETTANTISTICA,EMILIA ROMAGNA,BO,CASTENASO,associazioni sportive dilettantistiche,39,1611.29,232.12,1843.41
01072930256,A.C.D. UNION RIPA LA FENADORA,VENETO,BL,SEREN DEL GRAPPA,associazioni sportive dilettantistiche,60,1485.88,357.11,1842.99
94071400488,KIKAI DOJO A.S. D. ASSOCIAZIONE SPORTIVA DILETTANTISTICA,TOSCANA,FI,PELAGO,associazioni sportive dilettantistiche,40,1604.67,238.08,1842.75
93143160724,SOCIETA' SPORTIVA KIM YU SIN,PUGLIA,BA,PALO DEL COLLE,associazioni sportive dilettantistiche,108,1199.56,642.81,1842.37
01550800179,G.S. PAVONIANA CALCIO ASSOC. SPORT. DILETT.,LOMBARDIA,BS,BRESCIA,associazioni sportive dilettantistiche,22,1711.28,130.94,1842.22
93026020367,ASSOCIAZIONE SPORTIVA DILETTANTISTICA SAN FRANCESCO VOLLEY,EMILIA ROMAGNA,MO,SASSUOLO,associazioni sportive dilettantistiche,33,1645.35,196.41,1841.76
90013750824,A.S. DILETTANTISTICA TKD OLYMPIC'S GLADIATORS,SICILIA,PA,BAGHERIA,associazioni sportive dilettantistiche,84,1339.18,499.96,1839.14
